id	name	label	resource	description	synonyms	pmids	taxid	xrefs	raw_id
MONDO:0012227	myopia 7	Disease	MONDO		MYP7|myopia 7			UMLS:C1836506|OMIM:609256|MESH:C563761	MONDO:0012227
MONDO:0012057	legionnaire disease, susceptibility to	Disease	MONDO		legionnaire's disease|Legionella infection|legionnaire disease, susceptibility to|susceptibility to legionnaire disease			GARD:0006876|OMIM:608556	MONDO:0012057
MONDO:0006180	digestive system adenoma	Disease	MONDO	A sporadic or less frequently familial neoplasm, arising from the glandular epithelium of the stomach, small intestine, biliary tract, colon, and rectum. It is a polypoid or flat circumscribed lesion. Morphologically, it is characterized by a proliferation of neoplastic glandular cells and it is associated with dysplasia. According to the growth pattern, it may be classified as tubular, villous, or tubulovillous. The dysplasia is classified as mild, moderate, or severe. The frequency of malignant transformation depends on the size of the lesion and the degree of dysplasia. Larger adenomas with severe dysplastic changes (sometimes called carcinoma in situ) carry a higher risk of progressing to invasive adenocarcinoma. Gastrointestinal adenomas may present as solitary or multifocal lesions. Familial adenomas tend to be multifocal and carry a higher risk of malignant transformation. [NCIT:C36207]	digestive tract adenoma|GI adenoma|digestive system adenoma|gastrointestinal adenoma			DOID:4147|UMLS:C0948101|NCIT:C36207|EFO:1000217	MONDO:0006180
MONDO:0015048	amelogenesis imperfecta type 2	Disease	MONDO		amelogenesis imperfecta hypomaturation type|hypomaturation amelogenesis imperfecta			GARD:0008349|MESH:C536606|SCTID:109475005|Orphanet:100033|ORDO:100033|ICD-9:520.5|ICD9:520.5	MONDO:0015048
MONDO:0010112	thalamic degeneration, symmetric infantile	Disease	MONDO		symmetrical thalamic degeneration in infants|thalamic degeneration, symmetric infantile|symmetric infantile thalamic degeneration			ORDO:3311|OMIM:273490|UMLS:C2931220|MESH:C536504|GARD:0005160|Orphanet:3311	MONDO:0010112
MONDO:0013708	intellectual disability, autosomal recessive 25	Disease	MONDO		intellectual disability, autosomal recessive 25|mental retardation, autosomal recessive 25|MRT25			UMLS:C3280544|DOID:0081198|OMIM:614346	MONDO:0013708
MONDO:0024642	gastric neuroendocrine tumor G2	Disease	MONDO	A well differentiated, intermediate grade tumor with neuroendocrine differentiation that arises from the stomach. The mitotic count is 2-20 per 10 HPF and/or the Ki67 index is 3 to 20 percent. [NCIT:C95880]	gastric NET G2|gastric neuroendocrine tumor G2			NCIT:C95880|UMLS:C3272407	MONDO:0024642
MONDO:0034022	Bethlem myopathy 2	Disease	MONDO		Bethlem myopathy 2|COL12A1 Bethlem myopathy|BTHLM2|Bethlem myopathy type 2|Bethlem myopathy caused by mutation in COL12A1|EDS, myopathic type|Ehlers-Danlos syndrome, myopathic type|myopathic Ehlers-Danlos syndrome|myopathic EDS			OMIM:616471|UMLS:C4225313|Orphanet:536516|ORDO:536516	MONDO:0034022
MONDO:0014808	congenital secretory sodium diarrhea 8	Disease	MONDO	Any secretory diarrhea in which the cause of the disease is a mutation in the SLC9A3 gene. [MONDO:patterns/disease_series_by_gene]	diarrhea, congenital sodium|secretory diarrhea caused by mutation in SLC9A3|diarrhea 8, secretory sodium, congenital|SLC9A3 secretory diarrhea|congenital secretory sodium diarrhea type 8|DIAR8			OMIM:616868|UMLS:CN515063|DOID:0060777	MONDO:0014808
MONDO:0004187	nodular fasciitis	Disease	MONDO	A self-limiting, rapidly growing, non-encapsulated benign neoplasm that arises from the soft tissues. It is characterized by the presence of plump spindle-shaped fibroblasts, multinucleated osteoclast-like giant cells, chronic inflammatory infiltrate, red blood cell extravasation, and high mitotic activity. [NCIT:C3827]	pseudosarcomatous fasciitis|fasciitis - nodular|nodular fasciitis|pseudosarcomatous fibromatosis			ICD9:728.79|Orphanet:477742|ICD-9:728.79|UMLS:C0410005|SCTID:400138001|NCIT:C3827|ICD10CM:M72.4|ORDO:477742|DOID:7327	MONDO:0004187
MONDO:0019499	Turner syndrome	Disease	MONDO	Turner syndrome is a chromosomal disorder associated with the complete or partial absence of an X chromosome. [Orphanet:881]	gonadal dysgenesis Turner type|genital dwarfism, Turner type|45,X syndrome|Ullrich-Turner syndrome|monosomy X|Turner Varny syndrome|Schereshevkii Turner syndrome|genital dwarfism|45,X/46,XX syndrome|45X syndrome|gonadal dysgenesis|XO syndrome|45, X syndrome|chromosome X monosomy X|gonadal dysgenesis (45,X)|monosomy X syndrome|karyotype 45, X|Bonnevie-Ullrich syndrome|45,X0 syndrome|gonadal dysgenesis - Turner|45,X gonadal dysgenesis			MESH:D014424|Orphanet:881|UMLS:C0041408|GARD:0002458|GARD:0002459|NCIT:C26900|ICD9:758.7|MedDRA:10045181|ORDO:881|GARD:0007831|SCTID:38804009|ICD-9:758.7|GARD:0002540|DOID:3491	MONDO:0019499
MONDO:0000595	sexual and gender identity disorders	Disease	MONDO	A category of psychiatric disorders characterized by a disturbance in sexual desire and in the psychophysiological changes that make up the sexual response cycle. [NCIT:C92202]	sexual disorder			DOID:0060043|SCTID:231532002|NCIT:C92202	MONDO:0000595
MONDO:0016643	frontonasal dysplasia	Disease	MONDO	A group of rare bone development disorders characterized by an array of abnormalities affecting the eyes, forehead, and nose, and linked to midfacial dysraphia. The clinical picture is highly variable, but the major findings include hypertelorism, a broad nasal root, a large and bifid nasal tip, and widow's peak. Occasionally, abnormalities can include accessory nasal tags, cleft lip, ocular abnormalities (coloboma, cataract, microphthalmia), conductive hearing loss, basal encephalocele and/or agenesis of the corpus callosum. Intellectual deficit is rare and more likely to occur in cases where hypertelorism is severe or where there is extra-cranial involvement. [Orphanet:250]	FND1|median cleft syndrome|median cleft face syndrome|frontonasal dysplasia 1			UMLS:C1876203|OMIMPS:136760|Orphanet:250|DOID:0081044|MESH:C538065|GARD:0002392|ORDO:250|SCTID:86610004	MONDO:0016643
MONDO:0001695	senile ectropion	Disease	MONDO		involutional ectropion			SCTID:71659009|ICD9:374.11|ICD-9:374.11|DOID:13356|UMLS:C0155193	MONDO:0001695
MONDO:0017743	disorder of O-N-acetylgalactosaminylglycan synthesis	Disease	MONDO					UMLS:CN227190|ORDO:309458|Orphanet:309458	MONDO:0017743
MONDO:0017913	pure or complex hereditary spastic paraplegia	Disease	MONDO		Pure or complicated familial spastic paraplegia|Pure or complicated hereditary spastic paraplegia|Pure or complex familial spastic paraplegia			Orphanet:320335|UMLS:CN227219|ORDO:320335	MONDO:0017913
MONDO:0014265	Alzheimer disease 18	Disease	MONDO	Any Alzheimer disease in which the cause of the disease is a mutation in the ADAM10 gene. [MONDO:patterns/disease_series_by_gene]	Alzheimer's disease type 18|Alzheimer disease 18|AD18|Alzheimer disease caused by mutation in ADAM10|Alzheimer disease type 18|ADAM10 Alzheimer disease|Alzheimer disease 18, susceptibility to|Alzheimer disease 18, late-onset|Alzheimer's disease 18			UMLS:C3810041|OMIM:615590|DOID:0110050	MONDO:0014265
MONDO:0014605	microcephaly-corpus callosum hypoplasia-intellectual disability-facial dysmorphism syndrome	Disease	MONDO		intellectual disability, autosomal dominant 36|autosomal dominant non-syndromic intellectual disability 36|autosomal dominant intellectual disability 36|mental retardation, autosomal dominant 36|MRD36|mental retardation, autosomal dominant type 36|intellectual disability, autosomal dominant type 36|autosomal dominant mental retardation 36			ORDO:457284|DOID:0070066|Orphanet:457284|OMIM:616362	MONDO:0014605
MONDO:0014435	Bardet-Biedl syndrome 7	Disease	MONDO	Any Bardet-Biedl syndrome in which the cause of the disease is a mutation in the BBS7 gene. [MONDO:patterns/disease_series_by_gene]	BBS7 Bardet-Biedl syndrome|Bardet-Biedl syndrome 7|Bardet-Biedl syndrome caused by mutation in BBS7|BBS7|Bardet-Biedl syndrome type 7			GARD:0010206|EFO:0009026|UMLS:C1859565|OMIM:615984|DOID:0110129|MESH:C565916	MONDO:0014435
MONDO:0024472	boutonneuse fever	Disease	MONDO	An infectious disease of the Mediterranean area, the Crimea, Africa, and India, caused by infection with rickettsia conorii subsp. coronorii. [PMID:18760001]	Kenyan tick typhus|Rickettsia conorii spotted fever|Mediterranean tick fever|Kenya fever|boutonneuse fever|marseilles fever|boutonneuse disease|Mediterranean spotted fever|African tick typhus|tick typhus due to rickettsia conorii|fievre boutonneuse|South African tick-bite fever|Kenya tick typhus|Conor and Bruch's disease			ORDO:101334|MESH:D001907|Orphanet:101334|UMLS:C0006060|ICD9:082.1|DOID:14095|MedDRA:10006045|Orphanet:83313|ORDO:83313|SCTID:186774005|EFO:0007179|ICD-9:082.1	MONDO:0024472
MONDO:0003010	multilocular clear cell renal cell carcinoma	Disease	MONDO	A rare type of renal cell carcinoma. It is a well-circumscribed multicystic mass without solid areas. The inner lining of the cystic structures is composed of clear cells. [NCIT:C4524]	multilocular cystic renal cell carcinoma|multilocular cystic renal neoplasm of low malignant potential|multilocular clear cell renal cell carcinoma|multilocular clear cell renal cell adenocarcinoma|multilocular clear cell adenocarcinoma|MCRCC|multilocular cystic renal cell adenocarcinoma|multilocular cystic renal cell cancer|cystadenocarcinoma of kidney|multilocular clear cell carcinoma|renal cystadenocarcinoma|multilocular cystic clear cell renal cell neoplasm of low malignant potential			SCTID:254916002|Orphanet:319287|UMLS:C0346249|NCIT:C4524|DOID:4463|ICDO:8316/3|ICD9:189.0|ORDO:319287|ICD-9:189.0	MONDO:0003010
MONDO:0001492	kyphoscoliotic heart disease	Disease	MONDO					ICD-9:416.1|ICD9:416.1|DOID:12325|UMLS:C0152102|ICD10CM:I27.1|SCTID:45650007	MONDO:0001492
MONDO:0002592	invasive malignant thymoma	Disease	MONDO	A malignant thymoma that extends beyond the capsule and infiltrates the surrounding tissues. [NCIT:C7904]	infiltrating thymoma|malignant thymoma, invasive|invasive malignant thymoma|thymoma malignant invasive			DOID:3283|NCIT:C7904|UMLS:C0278846	MONDO:0002592
MONDO:0021367	leukemia, myeloid, accelerated-phase	Disease	MONDO	The phase of chronic myeloid leukemia following the chronic phase (leukemia, myeloid, chronic-phase), where there are increased systemic symptoms, worsening cytopenias, and refractory leukocytosis. [MESH:D015465]	Accelerated Phase Chronic Myelogenous Leukemia, BCR-ABL1 Positive|Accelerated Phase Chronic Myelogenous Leukemia|Myeloid Leukemia, Chronic, Accelerated-Phase|Leukemia, Myeloid, Aggressive-Phase|Accelerated phase chronic myeloid leukemia|Aggressive-Phase Chronic Myeloid Leukemia|Accelerated Phase Chronic Granulocytic Leukemia|Leukemia, Myeloid, Accelerated Phase|Myelogenous Leukemia, Chronic, Aggressive Phase|Myeloid Leukemia, Chronic, Aggressive Phase|Myeloid Leukemia, Chronic, Aggressive-Phase|Aggressive-Phase Chronic Myelocytic Leukemia|Aggressive-Phase CML|Accelerated Phase CML|Leukemia, Myelogenous, Aggressive Phase|Accelerated Phase Chronic Myeloid Leukemia|CML AGGRESSIVE|Accelerated Phase Chronic Myelocytic Leukemia|Myeloid Leukemia, Chronic, Accelerated Phase|Myelogenous Leukemia, Chronic, Aggressive-Phase|Leukemia, Myeloid, Accelerated-Phase|CML ACCELERATED|Aggressive-Phase Chronic Myelogenous Leukemia|Leukemia, Myelogenous, Aggressive-Phase			UMLS:C0023472|MESH:D015465|EFO:1001755	MONDO:0021367
MONDO:0021537	undifferentiated carcinoma of nasopharynx	Disease	MONDO	A undifferentiated carcinoma that involves the nasopharynx. [MONDO:patterns/location]	nasopharyngeal lymphoepithelioma|lymphoepithelioma of nasopharynx|undifferentiated carcinoma of the nasopharynx|nasopharyngeal nonkeratinizing undifferentiated carcinoma|lymphoepithelioma of the nasopharynx|undifferentiated nasopharyngeal throat cancer|nasopharyngeal undifferentiated carcinoma|nasopharynx undifferentiated carcinoma			SCTID:422541001|UMLS:C0279748|NCIT:C8023	MONDO:0021537
MONDO:0006565	juvenile dermatitis herpetiformis	Disease	MONDO	Dermatitis herpetiformis in children [EFO:1000719]				DOID:8507|ICD9:694.2|EFO:1000719|SCTID:5906000|ICD-9:694.2|UMLS:C0152092	MONDO:0006565
MONDO:0044646	early-onset progressive diffuse brain atrophy-microcephaly-muscle weakness-optic atrophy syndrome	Disease	MONDO		encephalopathy, progressive, early-onset, with brain atrophy and thin corpus callosum; PEBAT|encephalopathy, progressive, early-onset, with brain atrophy and thin corpus callosum|PEBAT			UMLS:C4310671|Orphanet:496641|DOID:0070423|OMIM:617193|ORDO:496641	MONDO:0044646
MONDO:0007835	intussusception	Disease	MONDO	Telescoping or invagination of a part of the intestine into an adjacent segment. [NCIT:P378]	intussusception|intussusception (morphologic abnormality)|invagination of intestine or colon|intussusception of intestine			ICD-9:560.0|MESH:D007443|ICD10CM:K56.1|OMIM:147710|ICD9:560.0|SCTID:49723003|UMLS:C0021933|DOID:8446	MONDO:0007835
MONDO:0007665	obsolete glaucoma 1, open angle, E	Disease	MONDO	OBSOLETE. A form of glaucoma in which there is no visible abnormality in the trabecular meshwork.	glaucoma, primary open angle, adult-onset|chronic simple glaucoma|glaucoma 1, open angle, E			OMIM:137760|DOID:1070|ICD9:365.11|NCIT:C35394|MESH:C562750|SCTID:77075001	MONDO:0007665
MONDO:0002973	epithelioid cell melanoma	Disease	MONDO	A melanoma characterized by the presence of malignant large epithelioid melanocytes. [NCIT:C4236]	epithelioid cell melanoma (morphologic abnormality)|epithelioid cell melanoma|epithelioid melanoma|epithelioid cell malignant melanoma			NCIT:C4236|UMLS:C0334443|ICDO:8771/3|DOID:4360	MONDO:0002973
MONDO:0020396	anomaly of the tricuspid valve chordae	Disease	MONDO	Anomaly of the tricuspid valve chordae is a rare, congenital anomaly of the tricuspid subvalvular apparatus characterized by aberrant tendinous chords, which insert at the clear zone of the leaflet instead of its free edge and connect to the endocardium instead of the papillary muscles. Resulting tethering of one or more tricuspid leaflets leads to their impaired mobility and tricuspid regurgitation. Association with other congenital cardiac anomalies has been reported. [Orphanet:99055]				Orphanet:99055|ORDO:99055	MONDO:0020396
MONDO:0021496	benign neoplasm of lip	Disease	MONDO	A benign neoplasm that involves the lip. [MONDO:patterns/location]	benign tumor of the Lip|lip neoplasm, benign|benign Lip neoplasm|lip benign neoplasm|benign Lip tumor|benign neoplasm of the Lip|benign tumor of Lip			ICD-9:210.0|ICD9:210.0|ICD10CM:D10.0|UMLS:C0153932|NCIT:C3591|SCTID:92185002	MONDO:0021496
MONDO:0008127	ophthalmomandibulomelic dysplasia	Disease	MONDO	Ophthalmomandibulomelic dysplasia is characterized by complete blindness due to corneal opacities, difficult mastication due to temporomandibular fusion and anomalies of the arms. [Orphanet:2741]	OMM syndrome|Pillay syndrome|ophthalmomandibulomelic dysplasia|Ophthalmo-mandibulo-melic dysplasia			Orphanet:2741|OMIM:164900|MESH:C563501|ORDO:2741|GARD:0004365|UMLS:C1833872|SCTID:715484003	MONDO:0008127
MONDO:0017259	obsolete systemic diseases with anterior uveitis	Disease	MONDO					UMLS:CN202777|Orphanet:280926	MONDO:0017259
MONDO:0009840	Partington-Anderson syndrome	Disease	MONDO		Partington-Anderson syndrome			MESH:C536299|Orphanet:2829|ORDO:2829|UMLS:CN202825|OMIM:260555|UMLS:C1850075	MONDO:0009840
MONDO:0009670	lethal congenital contracture syndrome 1	Disease	MONDO	Lethal congenital contracture syndrome type 1 is a rare, genetic arthrogryposis syndrome characterized by total fetal akinesia (detectable since the 13th week of gestation) accompanied by hydrops, micrognathia, pulmonary hypoplasia, pterygia and multiple joint contractures (usually flexion contractures in the elbows and extension in the knees), leading invariably to death before the 32nd week of gestation. Lack of anterior horn motoneurons, severe atrophy of the ventral spinal cord and severe skeletal muscle hypoplasia are characteristic neuropathological findings, with no evidence of other organ structural anomalies. [Orphanet:1486]	LCCS1|Herva disease|lethal autosomal recessive syndrome of multiple congenital contractures|lethal congenital contracture syndrome caused by mutation in GLE1|lethal congenital contracture syndrome 1|GLE1 lethal congenital contracture syndrome|lethal congenital contracture syndrome type 1|multiple contracture syndrome, Finnish type|Lccs			MESH:C537194|ORDO:1486|OMIM:253310|DOID:0060559|GARD:0003227|UMLS:C1854664|SCTID:715418007|Orphanet:1486	MONDO:0009670
MONDO:0017429	joint formation defects	Disease	MONDO					Orphanet:294949|ORDO:294949	MONDO:0017429
MONDO:0037747	spinal injury	Disease	MONDO	A injury that involves the vertebral column. [MONDO:patterns/location]	vertebral column injury|injury of vertebral column			SCTID:262521009|MESH:D013124	MONDO:0037747
MONDO:0002644	idiopathic granulomatous myositis	Disease	MONDO		granulomatous myositis|idiopathic granulomatous myositis			ORDO:206979|NCIT:C27575|UMLS:C1334150|DOID:3428|Orphanet:206979	MONDO:0002644
MONDO:0013497	Okt4 epitope deficiency	Disease	MONDO		Okt4 epitope deficiency|T4 epitope deficiency			OMIM:613949|UMLS:C3151379	MONDO:0013497
MONDO:0009227	myofibromatosis, infantile, 1	Disease	MONDO	Any myofibromatosis in which the cause of the disease is a mutation in the PDGFRB gene. [MONDO:patterns/disease_series_by_gene]	PDGFRB myofibromatosis|IMF1|myofibromatosis, juvenile|myofibromatosis, infantile, type 1|fibromatosis, congenital generalized|myofibromatosis caused by mutation in PDGFRB|myofibromatosis, infantile, 1			ICD9:756.9|SCTID:254146000|OMIM:228550|ICD-9:756.9|MESH:C562978	MONDO:0009227
MONDO:0013837	deafness-encephaloneuropathy-obesity-valvulopathy syndrome	Disease	MONDO	Deafness-encephaloneuropathy-obesity-valvulopathy syndrome is a rare mitochondrial disease with marked clinical variability typically characterized by encephalomyopathy, kidney disease (nephrotic syndrome), optic atrophy, early-onset deafness, pancytopenia, obesity, and cardiac disease (valvulopathy). Additionally, macrocephaly, intellectual disability, hyperlactatemia, elevated lactate/pyruvate ratio, insulin-dependent diabetes, livedo reticularis, liver dysfunction and seizures have also been associated. [Orphanet:254898]	COQ10D2|coenzyme Q10 deficiency, primary, type 2|hearing loss-encephaloneuropathy-obesity-valvulopathy syndrome|coenzyme Q10 deficiency, primary, 2			UMLS:C3553354|OMIM:614651|Orphanet:254898|ORDO:254898|DOID:0070239	MONDO:0013837
MONDO:0005635	adenomyoma	Disease	MONDO	A benign neoplasm characterized by the presence of a glandular and a mesenchymal (fibromyomatous) component. It occurs in the uterine corpus and the cervix. A variant of adenomyoma associated with glandular architectural complexity is called atypical polypoid adenomyoma. Simple polypectomy is usually curative. Atypical polypoid adenomyoma may recur following polypectomy. [NCIT:C3726]	adenomyoma (morphologic abnormality)|adenomyoma, benign|adenomyoma			ICDO:8932/0|MESH:D018194|UMLS:C0206622|NCIT:C3726|DOID:2609|EFO:0007133	MONDO:0005635
MONDO:0009057	cyanosis and hepatic disease	Disease	MONDO		cyanosis and hepatic disease			OMIM:219400|UMLS:C1857443|MESH:C565660	MONDO:0009057
MONDO:0014937	aniridia 2	Disease	MONDO		aniridia 2|AN2|aniridia 2; AN2|aniridia type 2			OMIM:617141|SCTID:253232000|MESH:C536372	MONDO:0014937
MONDO:0006735	duodenogastric reflux	Disease	MONDO	Retrograde flow of duodenal contents (bile acids; pancreatic juice) into the stomach. [MESH:D004383]	duodenogastric reflux (finding)			MESH:D004383|EFO:1000909|DOID:4071|UMLS:C0013299|MedDRA:10060865	MONDO:0006735
MONDO:0010189	vitiligo, progressive, with intellectual disability and urethral duplication	Disease	MONDO		vitiligo, progressive, with intellectual disability and urethral duplication|vitiligo, progressive, with mental retardation and urethral duplication			UMLS:C1848532|OMIM:277465|MESH:C564739	MONDO:0010189
MONDO:0007292	obsolete celiac artery stenosis from compression by median arcuate ligament of diaphragm	Disease	MONDO					UMLS:C1861783|MESH:C566151|OMIM:116870	MONDO:0007292
MONDO:0010359	Dent disease type 2	Disease	MONDO	Dent disease type 2 is a type of Dent disease in which patients have the manifestations of Dent disease type 1 associated with extra-renal features. [Orphanet:93623]	dent disease 2, X-linked recessive|Dent disease caused by mutation in OCRL|OCRL Dent disease|Dent disease type 2|DENT disease 2|nephrolithiasis type 2			SCTID:717790004|ORDO:93623|Orphanet:93623|OMIM:300555|UMLS:C4305529|MESH:C564487|UMLS:C1845167	MONDO:0010359
MONDO:0060642	neurodevelopmental disorder with movement abnormalities, abnormal gait, and autistic features	Disease	MONDO		neurodevelopmental disorder with movement abnormalities, abnormal gait, and autistic features|NEDMAGA			OMIM:617865|UMLS:CN800196	MONDO:0060642
MONDO:0011289	apraxia of eyelid opening	Disease	MONDO		apraxia of eyelid opening			OMIM:603119	MONDO:0011289
MONDO:0003870	childhood brainstem astrocytoma	Disease	MONDO	An astrocytoma that arises from the brain stem and occurs during childhood. [NCIT:P378]	childhood brainstem astrocytoma|pediatric brain stem astrocytic neoplasm|childhood brain stem astrocytoma|brain stem astrocytic neoplasm of childhood|childhood brain stem astrocytic neoplasm			NCIT:C6216|UMLS:C1332950|DOID:6386	MONDO:0003870
MONDO:0030847	arthrogryposis, distal, type 1C	Disease	MONDO		DA1C|arthrogryposis, distal, type 1C			OMIM:619110|DOID:0112190	MONDO:0030847
MONDO:0011459	arrhythmogenic right ventricular dysplasia 5	Disease	MONDO	Any arrhythmogenic right ventricular cardiomyopathy in which the cause of the disease is a mutation in the TMEM43 gene. [MONDO:patterns/disease_series_by_gene]	arrhythmogenic right ventricular dysplasia, familial, type 5|familial arrhythmogenic right ventricular dysplasia 5|ARVD5|arrhythmogenic right ventricular dysplasia, familial, 5|TMEM43 arrhythmogenic right ventricular cardiomyopathy|arrhythmogenic right ventricular cardiomyopathy caused by mutation in TMEM43|ARVC5|arrhythmogenic right ventricular dysplasia type 5|arrhythmogenic right ventricular dysplasia 5|arrhythmogenic right ventricular cardiomyopathy 5			OMIM:604400|UMLS:C1858379|DOID:0110074|MESH:C565776	MONDO:0011459
MONDO:0003257	posterior pituitary gland neoplasm	Disease	MONDO	A low-grade neoplasm that arises from the neurohypophysis. It includes the granular cell tumor of the neurohypophysis and pituicytoma. [NCIT:C7157]	posterior pituitary gland tumor|posterior pituitary gland neoplasm|neoplasm of neurohypophysis|Neurohypophysis tumor|tumor of neurohypophysis|neurohypophysis tumor|Neurohypophysis neoplasm|neurohypophysis neoplasm|neurohypophysis neoplasm (disease)|posterior pituitary tumor|PITUICYTOMA, benign|posterior pituitary neoplasm			NCIT:C7157|UMLS:C1334957|DOID:5048	MONDO:0003257
MONDO:0004970	adenocarcinoma	Disease	MONDO	A common cancer characterized by the presence of malignant glandular cells. Morphologically, adenocarcinomas are classified according to the growth pattern (e.g., papillary, alveolar) or according to the secreting product (e.g., mucinous, serous). Representative examples of adenocarcinoma are ductal and lobular breast carcinoma, lung adenocarcinoma, renal cell carcinoma, hepatocellular carcinoma (hepatoma), colon adenocarcinoma, and prostate adenocarcinoma. [NCIT:C2852]	adenocarcinoma, no subtype (morphologic abnormality)|adenocarcinomas|adenocarcinoma, malignant|ADNOS|adenocarcinoma NOS (morphologic abnormality)|adenocarcinoma			ICDO:8140/3|DOID:299|ONCOTREE:ADNOS|EFO:0000228|SCTID:443961001|UMLS:C0001418|MESH:D000230|NCIT:C2852|CSP:2000-0386	MONDO:0004970
MONDO:0004357	carcinoma of supraglottis	Disease	MONDO	A carcinoma of the larynx that arises from the supraglottic area. [NCIT:P378]	cancer of supraglottis|carcinoma of the supraglottis|cancer of the supraglottis|supraglottic cancer|supraglottic throat cancer|supraglottic part of larynx carcinoma|carcinoma of supraglottis|carcinoma of supraglottic part of larynx|supraglottis carcinoma|supraglottic carcinoma			NCIT:C5973|SCTID:372105009|DOID:7763|UMLS:C1299240	MONDO:0004357
MONDO:0003087	mucoepidermoid breast carcinoma	Disease	MONDO	A carcinoma of the breast characterized by pools of mucin and islands of malignant squamous cells. Mucoepidermoid carcinomas of the breast are extremely rare. [NCIT:C5166]	mucoepidermoid carcinoma of the breast|breast mucoepidermoid carcinoma|mucoepidermoid breast carcinoma|mucoepidermoid carcinoma of breast			DOID:4679|UMLS:C1334813|NCIT:C5166	MONDO:0003087
MONDO:0013294	dermatitis, atopic, 8	Disease	MONDO	An inherited susceptibility or predisposition to developing atopic dermatitis that is associated with variation in the region 4q22.1. [DOID:0110104, MONDO:patterns/inherited_susceptibility, PMID:19517137]	atopic dermatitis type 8|dermatitis, atopic, 8|dermatitis, atopic, severity of|ATOD8|dermatitis, atopic, susceptibility to, 8			DOID:0110104|OMIM:613518|UMLS:C3150763	MONDO:0013294
MONDO:0014394	Diamond-Blackfan anemia 13	Disease	MONDO	Any Diamond-Blackfan anemia in which the cause of the disease is a mutation in the RPS29 gene. [MONDO:patterns/disease_series_by_gene]	Diamond-Blackfan anemia caused by mutation in RPS29|Diamond-Blackfan Anemia type 13|RPS29 Diamond-Blackfan anemia|Diamond-Blackfan anemia 13|DBA13			DOID:0111889|UMLS:C4014641|OMIM:615909	MONDO:0014394
