id	name	label	resource	description	synonyms	pmids	taxid	xrefs	raw_id
MONDO:0012406	hyperparathyroidism 3	Disease	MONDO		hyperparathyroidism 3|hyperparathyroidism, familial isolated|HRPT3			UMLS:C1864729|MESH:C566450|OMIM:610071	MONDO:0012406
MONDO:0012236	keratoconus 4	Disease	MONDO		keratoconus 4|KTCN4			MESH:C563752|OMIM:609271|UMLS:C1836473	MONDO:0012236
MONDO:0009955	rapadilino syndrome	Disease	MONDO	RAPADILINO syndrome is a syndrome for which the acronym indicates the principal signs: RA for radial ray defect, PA for both patellae hypoplasia or aplasia and cleft or highly arched palate, DI for diarrhea and dislocated joints, LI for little size and limb malformations, NO for long, slender nose and normal intelligence. [Orphanet:3021]	radial and patellar hypoplasia|radial and patellar aplasia|absent thumbs, dislocated joints, long face with narrow palpebral fissures, long slender nose, arched palate|rapadilino syndrome			MESH:C535288|UMLS:C1849453|Orphanet:3021|DOID:0050774|ICD9:759.89|OMIM:266280|ICD-9:759.89|ORDO:3021|SCTID:702413000|GARD:0004637	MONDO:0009955
MONDO:0007511	ectodermal dysplasia, trichoodontoonychial type	Disease	MONDO	Ectodermal dysplasia, trichoodontoonychial type is a form of ectodermal dysplasia with hair, teeth and nail involvement characterized predominantly by hypodontia, hypotrichosis, delayed hair growth and brittle nails. Additionally, focal dermal hypoplasia, irregular hyperpigmentation, hypoplastic or absent nipples, amastia, hearing impairment, congenital hip dislocation and asthma have been associated. There have been no further descriptions in the literature since 1996. [Orphanet:1818]	ectodermal dysplasia trichoodontoonychial type|ectodermal dysplasia, trichoodontoonychial type			GARD:0002055|UMLS:C1851858|MESH:C565068|Orphanet:1818|OMIM:129510|ORDO:1818|SCTID:734018003	MONDO:0007511
MONDO:0007341	cleidorhizomelic syndrome	Disease	MONDO	Cleidorhizomelic syndrome is a rhizo-mesomelic dysplasia characterized by rhizomelic short stature/dwarfism in combination with lateral clavicular defects. Additional manifestations include brachydactyly with bilateral clinodactyly and hypoplastic middle phalanx of the fifth digit. X-ray demonstrated an apparent Y-shaped or bifid distal clavicle. Cleidorhizomelic syndrome has been reported in one family (mother and son) and is suspected to be transmitted in an autosomal dominant manner. There have been no further descriptions in the literature since 1988. [Orphanet:1453]	Wallis-Zieff-Goldblatt syndrome|cleidorhizomelic syndrome|Wallis Zieff Goldblatt syndrome|brachydactyly, enlarged diaphysis, rhizomelic micromelia, short stature and abnormal clavicle|cleido rhizomelic syndrome|rhizomelic shortness with clavicular defect			MESH:C536428|Orphanet:1453|GARD:0005532|SCTID:719471002|OMIM:119650|UMLS:C1861515|ORDO:1453	MONDO:0007341
MONDO:0010408	syndactyly-telecanthus-anogenital and renal malformations syndrome	Disease	MONDO	This syndrome is characterised by the association of toe syndactyly, facial dysmorphism including telecanthus (abnormal distance between the eyes) and a broad nasal tip, urogenital malformations and anal atresia. [Orphanet:140952]	syndactyly, telecanthus, anogenital and renal malformations|syndactyly-telecanthus-anogenital and renal malformations syndrome|STAR|syndactyly with renal and anogenital malformations|STAR syndrome|toe syndactyly, telecanthus, and anogenital and renal malformations|toe syndactyly, telecanthus, anogenital and renal malformations|Star syndrome|STAR syndrome, X-linked dominant			GARD:0010295|ORDO:140952|SCTID:723581006|UMLS:C2678045|MESH:C567475|DOID:0111931|Orphanet:140952|OMIM:300707	MONDO:0010408
MONDO:0016822	myalgia-eosinophilia syndrome associated with tryptophan	Disease	MONDO	A rare systemic disease characterized by severe myalgia and peripheral eosinophilia associated with tryptophan dietary supplementation. The symptoms do not subside after tryptophan discontinuation. Clinical presentation includes muscle tenderness and cramps, fatigue, weakness, paresthesia, peripheral edema, arthralgia, dyspnea, skin rash, dry mouth, and development of scleroderma-like skin abnormalities. [Orphanet:2582]				ORDO:2582|Orphanet:2582|MedDRA:10014952|MESH:D016603	MONDO:0016822
MONDO:0000688	inborn organic aciduria	Disease	MONDO	An inherited disorder that affects the metabolism of any acidic compound containing carbon in a covalent linkage. [NCIT:C101334]	rare inborn error of organic acid metabolic process|inborn error of organic acid metabolic process|organic acidemia|organic acid metabolism disorder|disorder of organic acid metabolism|inherited organic acidemia|organic aciduria|inborn organic acid metabolic process disorder			ICD-9:277.89|DOID:0060159|UMLS:C1263739|GARD:0009433|ORDO:289899|NCIT:C101334|ICD9:277.89|Orphanet:289899	MONDO:0000688
MONDO:0000858	neuronal intestinal dysplasia	Disease	MONDO					ICD-9:751.5|SCTID:253783001|ICD9:751.5|DOID:0080072|UMLS:C0345244	MONDO:0000858
MONDO:0020072	childhood-onset epilepsy syndrome	Disease	MONDO	A epilepsy syndrome that occurs during childhood. [MONDO:design_pattern]	epilepsy syndrome of childhood|childhood epilepsy syndrome|childhood-onset epilepsy syndrome|pediatric epilepsy syndrome			ORDO:98259|UMLS:CN206976|Orphanet:98259	MONDO:0020072
MONDO:0008984	ciliary discoordination due to random ciliary orientation	Disease	MONDO		ciliary discoordination due to random ciliary orientation|ciliary discoordination, due to random ciliary orientation|Rutland ciliary disorientation syndrome			UMLS:C0340038|ICD9:759.89|SCTID:233667003|ICD-9:759.89|OMIM:215518|MESH:C562757|GARD:0001360	MONDO:0008984
MONDO:0017922	deafness-onychodystrophy syndrome	Disease	MONDO	Deafness-onychodystrophy syndrome is a group of rare, genetic, developmental defect during embryogenesis disorders characterized by the association of sensorineural deafness and onychodystrophy (e.g. absent/hypoplastic finger and toenails), as well as brachydactyly and finger-like thumbs. Additional features present in one of the diseases comprising this group include osteodystrophy, intellectual disability, seizures, developmental delay, and distinctive facies. [Orphanet:3231]				UMLS:CN204041|Orphanet:3231|ORDO:3231	MONDO:0017922
MONDO:0001788	nutmeg liver	Disease	MONDO		chronic passive congestion of liver			UMLS:C0156195|ICD-9:573.0|DOID:13739|ICD9:573.0|SCTID:34736002	MONDO:0001788
MONDO:0021172	Timothy syndrome, atypical type	Disease	MONDO	Atypical form of Timothy syndrome, causes a more severe form of long QT syndrome and a greater risk of arrhythmia and sudden death. [https://ghr.nlm.nih.gov/condition/timothy-syndrome]	Timothy syndrome type 2 (disorder)|atypical Timothy syndrome|ATS|Atypical LQT8			ORDO:595109|SCTID:719907006|ICD10CM:I49.8|Orphanet:595109|UMLS:C4304347	MONDO:0021172
MONDO:0009720	Keipert syndrome	Disease	MONDO	A rare multiple congenital anomalies syndrome characterized by facial dysmorphism (hypertelorism, broad and high nasal bridge, depressed nasal ridge, short columella, underdeveloped maxilla, and prominent cupid-bow upper lip vermillion), mild to severe congenital sensorineural hearing loss, and skeletal abnormalities consisting of brachytelephalangy and broad thumbs and halluces with large, rounded epiphyses. Additional manifestations that have been reported include pulmonary valve stenosis, voice hoarseness and renal agenesis. [Orphanet:2662]	Keipert syndrome, X-linked recessive|Keipert syndrome|nasodigitoacoustic syndrome|KPTS|nasodigitoacoustic syndrome, formerly			UMLS:C1850627|MESH:C538337|OMIM:301026|NCIT:C186306|GARD:0000267|Orphanet:2662|OMIM:255980|ORDO:2662|SCTID:763774001|DOID:0111842	MONDO:0009720
MONDO:0011995	cataract - congenital heart disease - neural tube defect syndrome	Disease	MONDO	Cataract-congenital heart disease-neural tube defect syndrome is a multiple congenital anomaly syndrome characterized by sacral neural tube defects resulting in tethered cord, atrial and/or ventricular septal heart defects (that are detected in infancy), bilateral, symmetrical hyperopia, rapidly progressive early childhood cataracts, bilateral aphakic glaucoma, and abnormal facial features (low frontal hairline, small ears, short philtrum, prominent, widely spaced central incisors, and micrognathia). hypotonia, growth and developmental delay, seizures, and joint limitation are also reported. [Orphanet:314993]	craniofacial abnormalities, cataracts, congenital heart disease, sacral neural tube defects, and growth and developintellectual disability|craniofacial abnormalities, cataracts, congenital heart disease, sacral neural tube defects, and growth and developmental retardation			Orphanet:314993|ORDO:314993|UMLS:C1842363|MESH:C564271|OMIM:608227	MONDO:0011995
MONDO:0007555	pidermolysis bullosa simplex 5A, Ogna type	Disease	MONDO	A basal subtype of epidermolysis bullosa simplex (EBS) characterized by sometimes widespread, primarily acral blistering. [https://orcid.org/0000-0001-5208-3432, Orphanet:79401]	epidermolysis bullosa simplex, Ogna type|EBSOG|EBS-Og|epidermolysis bullosa simplex 5A, Ogna type|EBS-O			Orphanet:79401|OMIM:131950|DOID:0060736|ICD-9:757.39|MESH:C535962|ICD9:757.39|GARD:0002148|ORDO:79401|SCTID:398071000	MONDO:0007555
MONDO:0013513	atrial fibrillation, familial, 9	Disease	MONDO	Any familial atrial fibrillation in which the cause of the disease is a mutation in the KCNJ2 gene. [MONDO:patterns/disease_series_by_gene]	KCNJ2 familial atrial fibrillation|familial atrial fibrillation caused by mutation in KCNJ2|atrial fibrillation, familial, type 9|ATFB9|atrial fibrillation, familial, 9			OMIM:613980|UMLS:C3151431	MONDO:0013513
MONDO:0019678	brachydactyly type A5	Disease	MONDO	Brachydactyly type A5 (BDA5) is a very rare congenital malformation of the digits characterized by absence of the middle phalanges (usually of digits 2 to 5), nail dysplasia and duplicated terminal phalanx of the thumb. [Orphanet:93389]	absent middle phalanges of digits 2-5 with nail dysplasia|brachydactyly type A5 nail dysplasia|brachydactyly with absence of middle phalanges and hypoplastic nails			SCTID:720570007|OMIM:112900|UMLS:C1862138|GARD:0000982|Orphanet:93389|ORDO:93389|MESH:C537091	MONDO:0019678
MONDO:0019314	cutaneous mastocytoma	Disease	MONDO	Cutaneous mastocytoma is a form of cutaneous mastocytosis (CM) generally characterized by the presence of a solitary or multiple hyperpigmented macules, plaques or nodules associated with abnormal accumulation of mast cells in the skin. [Orphanet:79455]	multiple mastocytoma|solitary mastocytoma|cutaneous local mastocytoma			Orphanet:79455|MESH:D054705|GARD:0012687|ORDO:79455	MONDO:0019314
MONDO:0007385	idiopathic spontaneous coronary artery dissection	Disease	MONDO		coronary artery dissection, spontaneous|idiopathic SCAD			MESH:C565153|Orphanet:458718|UMLS:C1852540|ORDO:458718|OMIM:122455	MONDO:0007385
MONDO:0013343	C1Q deficiency	Disease	MONDO	C1q deficiency is a rare disorder associated with recurrent skin lesions, chronic infections, systemic lupus erythematosus (SLE) or SLE-like diseases. It has also been associated with a kidney disease known as mesangial proliferative glomerulonephritis. C1q is a complex and together with other proteins, C1r and C1s, it forms the C1 complex. This complex is important for the activation of the complement system (a group of proteins that work with the immune system). It also disposes cells that are dead. C1q deficiency presents in 2 different forms, absent C1q protein or abnormal C1q protein. Symptoms include infections (ear infections (otitis media), meningitis, urinary tract infections, oral infections); skin lesions (small blisters (vesicles), dark patches, and atrophic areas) that get worse upon light exposure; cataracts; loss of eyelashes, eyebrows, and scalp hair; blood in urine; and glomerulonephritis. About 93% of cases are associated with systemic lupus erythematosus. It can be caused by mutations in the C1QA, C1QB or C1QC genes and is inherited in an autosomal recessive pattern. Treatment depends on the symptoms. Recently, it was shown that C1q production can be restored by allogeneic hematopoietic stem cell transplantation, a procedure in which a person receives blood-forming stem cells (cells from which all blood cells develop) from a genetically similar, but not identical donor. [https://rarediseases.info.nih.gov/diseases/12958/c1q-deficiency, PMID:29449492]	C1QD|C1Q deficiency|C1q deficiency			NCIT:C119990|OMIM:613652|UMLS:C3150902|GARD:0012958	MONDO:0013343
MONDO:0005141	Pseudomonas infection	Disease	MONDO	Infections with bacteria of the genus pseudomonas. [MESH:D011552]	Pseudomonas disease or disorder|Pseudomonas infectious disease|Pseudomonas caused disease or disorder			SCTID:63398001|EFO:0001076|ICD9:041.7|ICD-9:041.7|MESH:D011552	MONDO:0005141
MONDO:0014613	pulmonary fibrosis and/or bone marrow failure, Telomere-related, 3	Disease	MONDO	Any pulmonary fibrosis and/or bone marrow failure, Telomere-related in which the cause of the disease is a mutation in the RTEL1 gene. [MONDO:patterns/disease_series_by_gene]	RTEL1 pulmonary fibrosis and/or bone marrow failure, Telomere-related|pulmonary fibrosis and/or bone marrow failure, Telomere-related, 3|PFBMFT3|pulmonary fibrosis and/or bone marrow failure, Telomere-related, type 3|pulmonary fibrosis and/or bone marrow failure, TELOMERE-RELATED, 3|pulmonary fibrosis and/or bone marrow failure, Telomere-related caused by mutation in RTEL1			OMIM:616373|UMLS:C4225346	MONDO:0014613
MONDO:0014443	Bardet-Biedl syndrome 15	Disease	MONDO	Any Bardet-Biedl syndrome in which the cause of the disease is a mutation in the WDPCP gene. [MONDO:patterns/disease_series_by_gene]	BBS15|Bardet-Biedl syndrome type 15|Bardet-Biedl syndrome caused by mutation in WDPCP|Bardet-Biedl syndrome 15|WDPCP Bardet-Biedl syndrome			DOID:0110137|UMLS:C3150127|OMIM:615992	MONDO:0014443
MONDO:0005311	atherosclerosis	Disease	MONDO	Build-up of fatty material and calcium deposition in the arterial wall resulting in partial or complete occlusion of the arterial lumen. [NCIT:C35768]	atherosclerosis artery|atherosclerotic cardiovascular disease|atherosclerosis of artery			NCIT:C35768|DOID:1936|MESH:D050197|ICD10CM:I70|ICD9:440.8|ICD-9:440|SCTID:441574008|NCIT:C35771|ICD9:440|EFO:0003914|ICD-9:440.8	MONDO:0005311
MONDO:0006241	hepatic granuloma	Disease	MONDO	A granuloma located in the liver. [NCIT:P378]				ICD9:572.8|EFO:1000291|UMLS:C0745754|SCTID:714253009|ICD-9:572.8	MONDO:0006241
MONDO:0006411	sinonasal undifferentiated carcinoma	Disease	MONDO	A rare, highly aggressive carcinoma that arises from the sinonasal tract. It is characterized by the presence of small to medium size malignant cells. The prognosis is poor. [NCIT:C54294]	Sinonasal anaplastic carcinoma|sinonasal undifferentiated carcinoma|SNUC|undifferentiated Sinonasal cancer|highly aggressive undifferentiated carcinoma of the nasal cavity and paranasal sinuses			UMLS:C1710096|ONCOTREE:SNUC|MESH:C537344|DOID:0080799|EFO:1000527|SCTID:697993003|GARD:0009249|NCIT:C54294	MONDO:0006411
MONDO:0004893	hypertropia	Disease	MONDO	Vertical strabismus in which there is permanent upward deviation of the visual axis of one eye. [NCIT:P378]				DOID:9837|ICD-9:378.31|ICD9:378.31|SCTID:40608009|UMLS:C0020575|NCIT:C34716	MONDO:0004893
MONDO:0010851	Lowry-MacLean syndrome	Disease	MONDO	Lowry-MacLean syndrome is a very rare syndrome characterized by microcephaly, craniosynostosis, glaucoma, growth failure and visceral malformations. [Orphanet:2409]	Lowry MacLean syndrome|mental retardation, cleft palate, eventration of diaphragm, congenital heart defect, glaucoma, craniosynostosis and growth failure|intellectual disability, cleft palate, eventration of diaphragm, congenital heart defect, glaucoma, craniosynostosis and growth failure|Lowry-MacLean syndrome			SCTID:721974000|MESH:C537037|ORDO:2409|GARD:0003300|OMIM:600252|Orphanet:2409|UMLS:C0796020	MONDO:0010851
MONDO:0011135	superior transverse scapular ligament, calcification of, familial	Disease	MONDO		superior transverse scapular ligament, calcification of, familial			MESH:C566638|UMLS:C1866424|OMIM:601708	MONDO:0011135
MONDO:0011305	cerebral cavernous malformation 3	Disease	MONDO	Any familial cerebral cavernous malformation in which the cause of the disease is a mutation in the PDCD10 gene. [MONDO:patterns/disease_series_by_gene]	cerebral cavernous malformation type 3|cerebral cavernous malformations type 3|PDCD10 familial cerebral cavernous malformation|CCM3|cerebral cavernous malformations-3|familial cerebral cavernous malformation caused by mutation in PDCD10|cerebral cavernous malformations 3|cerebral cavernous malformation 3			DOID:0060671|MESH:C566393|UMLS:C1864040|OMIM:603285	MONDO:0011305
MONDO:0056819	nasal cavity and paranasal sinus carcinoma	Disease	MONDO	A carcinoma arising from the nasal cavity or paranasal sinuses. [NCIT:C54293]	nasal cavity and paranasal sinus cancer|sinonasal carcinoma|nasal cavity and paranasal sinus carcinoma|paranasal sinus and nasal cavity cancer			NCIT:C54293|GARD:0007650|UMLS:C1710095	MONDO:0056819
MONDO:0020446	coronary sinus stenosis	Disease	MONDO					ORDO:99117|Orphanet:99117	MONDO:0020446
MONDO:0036688	rhabdomyoma	Disease	MONDO	A benign mesenchymal tumor arising from skeletal or cardiac muscle. [NCIT:C3358]	rhabdomyoma, benign|Rhabdomyomatous neoplasm|rhabdomyoma			MESH:D012207|SCTID:402877008|UMLS:C0035411|ICDO:8900/0|NCIT:C3358	MONDO:0036688
MONDO:0012405	polyposis syndrome, hereditary mixed, 2	Disease	MONDO	Any hereditary mixed polyposis syndrome in which the cause of the disease is a mutation in the BMPR1A gene. [MONDO:patterns/disease_series_by_gene]	polyposis syndrome, hereditary mixed, type 2|HMPS2|polyposis syndrome, hereditary mixed, 2|hereditary mixed polyposis syndrome caused by mutation in BMPR1A|BMPR1A hereditary mixed polyposis syndrome			MESH:C566451|OMIM:610069|UMLS:C1864730|DOID:0111686	MONDO:0012405
MONDO:0017106	retrocerebellar cyst	Disease	MONDO		retrocerebellar cyst (disease)|Retrocerebellar cyst|Retrocerebellar arachnoid cyst			ORDO:269200|HP:HP:0006951|HP:0006951|Orphanet:269200	MONDO:0017106
MONDO:0021546	ependymal tumor of spinal cord	Disease	MONDO	An ependymal tumor that arises from the spinal cord. [NCIT:C131526]	spinal cord ependymal tumor|ependymal tumor of spinal cord			UMLS:C4318747|NCIT:C131526	MONDO:0021546
MONDO:0002685	childhood choroid plexus carcinoma	Disease	MONDO	A choroid plexus carcinoma that occurs during childhood. [NCIT:C124292]	choroid plexus carcinoma of childhood|childhood choroid plexus neoplasm|childhood choroid plexus cancer|childhood choroid plexus carcinoma|pediatric choroid plexus carcinoma			DOID:3545|UMLS:C0280623|NCIT:C124292	MONDO:0002685
MONDO:0012235	autosomal recessive spinocerebellar ataxia 7	Disease	MONDO	Spinocerebellar ataxia autosomal recessive 7, also called SCAR7, is a slowly progressive hereditary form of spinocerebellar ataxia. Symptoms of SCAR7 can include difficulty walking and writing, speech difficulties (dysarthria), limb ataxia, and a decrease in the size of a region of the brain called the cerebellum (cerebellar atrophy). Of the few reported cases in the literature, some patients also had eye involvement that included nystagmus (in voluntary eye movements)and saccadic pursuit eye movements. Out of 5 affected siblings examined in a large Dutch family, 2 became wheelchair-dependent late in life. The severity of the symptoms varies from mild to severe. SCAR7 is caused by mutations in the TPP1 gene and is inherited in an autosomal recessive manner. [https://rarediseases.info.nih.gov/diseases/12232/spinocerebellar-ataxia-autosomal-recessive-7]	childhood onset autosomal recessive slowly progressive spinocerebellar ataxia|spinocerebellar ataxia, autosomal recessive 7|spinocerebellar ataxia, autosomal recessive type 7|SCAR7|childhood-onset autosomal recessive slowly progressive spinocerebellar ataxia|spinocerebellar ataxia autosomal recessive 7|autosomal recessive spinocerebellar ataxia type 7			Orphanet:284324|GARD:0012232|OMIM:609270|MESH:C563753|ORDO:284324|UMLS:C1836474|DOID:0080059	MONDO:0012235
MONDO:0004033	obsolete familial ovarian carcinoma	Disease	MONDO					DOID:6901|UMLS:C1333992	MONDO:0004033
MONDO:0014614	congenital stationary night blindness 1G	Disease	MONDO	A congenital stationary night blindness characterized by autosomal recessive inheritance that has material basis in homozygous mutation in the GNAT1 gene on chromosome 3p21. [DOID:0110714, PMID:22190596]	night blindness, congenital stationary, type 1G|congenital stationary night blindness type 1G|CSNB1G			OMIM:616389|UMLS:C4225345|DOID:0110714	MONDO:0014614
MONDO:0009098	dextrocardia with unusual facies and microphthalmia	Disease	MONDO		dextrocardia, microphthalmia, cleft palate, choreoathetosis and mental retardation|dextrocardia, microphthalmia, cleft palate, choreoathetosis and intellectual disability|Aughton syndrome|dextrocardia with unusual facies and microphthalmia			UMLS:C1857298|MESH:C538269|OMIM:221950|GARD:0000136	MONDO:0009098
MONDO:0005879	ocular toxoplasmosis	Disease	MONDO	Ocular toxoplasmosis is an infection in the eye caused by the parasite, Toxoplasm a gondii. Toxoplasmosis is the most common cause of eye inflammation in the world. Toxoplamosis can beacquired or present at birth (congenital), having crossed the placenta from a newly infected mother to her fetus. Most humans acquire toxoplasmosis by eating raw or undercooked meat, vegetables or milk products, or by coming into contact with infected cat litterbox or sandboxes.In humans,the infectionusually causes no symptoms, and resolves without treatment in a few months. In individuals with compromised immune systems, Toxoplasm a gondii can reactivate to cause disease. Reactivation of a congenital infection was traditionally thought to be the most common cause ofocular toxoplasmosis, but an acquired infection is now considered to be more common. A toxoplasmosis infection that affects the eye usually attacks the retina andinitially resolves without symptoms. However,the inactive parasite maylaterreactivate causing eyepain, blurred vision, and possibly permanent damage, including blindness. Although most cases of toxoplasmosis resolve on their own,for some,inflammation can be treated with antibiotics and steroids. [https://rarediseases.info.nih.gov/diseases/7238/ocular-toxoplasmosis]				EFO:0007399|GARD:0007238|SCTID:416481006|ICD-9:130.7|MESH:D014126|ICD9:130.7|UMLS:C0040561	MONDO:0005879
MONDO:0013140	candidiasis, familial, 4	Disease	MONDO	Any familial chronic mucocutaneous candidiasis in which the cause of the disease is a mutation in the CLEC7A gene. [MONDO:patterns/disease_series_by_gene]	CLEC7A familial chronic mucocutaneous candidiasis|familial chronic mucocutaneous candidiasis caused by mutation in CLEC7A|candidiasis, familial chronic mucocutaneous|candidiasis, familial, 4|CANDF4|candidiasis, familial, type 4|candidiasis, familial, 4, autosomal recessive			OMIM:613108|UMLS:C0341024|SCTID:235073000	MONDO:0013140
MONDO:0024481	skin appendage disorder	Disease	MONDO	A disease that involves the cutaneous appendage. [MONDO:patterns/location]	disorder of cutaneous appendage|disease of cutaneous appendage|disorder of skin appendage|disease of epidermal appendages|cutaneous appendage disease or disorder|disease of epidermal appendage|cutaneous appendage disease|disease or disorder of cutaneous appendage			UMLS:C0037272|ICD10CM:L60-L75|SCTID:238714008	MONDO:0024481
MONDO:0024651	corticosteroid-induced osteoporosis	Disease	MONDO		osteoporosis due to corticosteroid|osteoporosis caused by corticosteroid			ICD-9:733.09|SCTID:390833005|UMLS:C1272167|ICD9:733.09	MONDO:0024651
MONDO:0014070	oculocutaneous albinism type 7	Disease	MONDO	Oculocutaneous albinism type 7 (OCA7), formerly called OCA5, is a form of oculocutaneous albinism (OCA) characterized by skin and hair hypopigmentation, nystagmus and iris transillumination. [Orphanet:352745]	OCA7|oculocutaneous albinism caused by mutation in LRMDA|oculocutaneous albinism type VII|albinism, oculocutaneous, type 7|albinism, oculocutaneous, type VII|LRMDA oculocutaneous albinism			OMIM:615179|ORDO:352745|Orphanet:352745|SCTID:722059002|UMLS:C3808786|UMLS:CN204524|DOID:0070100	MONDO:0014070
MONDO:0014240	periventricular nodular heterotopia 6	Disease	MONDO	Any periventricular nodular heterotopia in which the cause of the disease is a mutation in the ERMARD gene. [MONDO:patterns/disease_series_by_gene]	periventricular nodular heterotopia caused by mutation in ERMARD|ERMARD periventricular nodular heterotopia|PVNH6|periventricular nodular heterotopia 6|periventricular nodular heterotopia type 6			OMIM:615544|UMLS:C3809872	MONDO:0014240
MONDO:0006979	steatitis	Disease	MONDO	A disease of cats and mink characterized by a marked inflammation of adipose tissue and the deposition of 'ceroid' pigment in the interstices of the adipose cells. It is believed to be caused by feeding diets containing too much unsaturated fatty acid and too little vitamin E. (Merck Veterinary Manual, 5th ed; Stedman, 25th ed) [MESH:D013231]	Nutritional Panniculitis|Yellow fat disease|Nutritional Steatitis			UMLS:C0038235|EFO:1001191|DOID:4025|SCTID:33882007|MESH:D013231	MONDO:0006979
MONDO:0010205	obsolete Wolman disease with hypolipoproteinemia and acanthocytosis	Disease	MONDO					UMLS:C1848436|OMIM:278100|MESH:C564736	MONDO:0010205
