id	name	label	resource	description	synonyms	pmids	taxid	xrefs	raw_id
MONDO:0018305	chronic granulomatous disease	Disease	MONDO	Chronic granulomatous disease (CGD) is a rare primary immunodeficiency, mainly affecting phagocytes, which is characterized by an increased susceptibility to severe and recurrent bacterial and fungal infections, along with the development of granulomas. [Orphanet:379]	granulomatous disease, chronic|Quie syndrome|chronic septic granulomatosis|CGD|congenital dysphagocytosis|Bridges-Good syndrome			NCIT:C26788|Orphanet:379|UMLS:C0018203|MedDRA:10008906|SCTID:387759001|GARD:0006100|MESH:D006105|DOID:3265|OMIMPS:306400|ORDO:379	MONDO:0018305
MONDO:0019405	facial onset sensory and motor neuronopathy	Disease	MONDO	Facial onset sensory and motor neuronopathy is characterised initially by paraesthesia and numbness in the region of the trigeminal nerve distribution, which later progresses to involve the scalp, neck, upper trunk and upper limbs. Onset of motor manifestations occurs later with cramps, fasciculations, dysphagia, dysarthria, muscle weakness and atrophy. This syndrome has been described in four males and appears to be a slowly progressive neurodegenerative disease. [Orphanet:85162]	FOSMN syndrome|facial onset sensorimotor neuronopathy syndrome|facial onset sensory and motor neuronopathy syndrome			Orphanet:85162|UMLS:CN206118|GARD:0012036|SCTID:723306004|ORDO:85162	MONDO:0019405
MONDO:0005906	peritonsillar abscess	Disease	MONDO	An abscess that develops in the space surrounding one or both palatine tonsils. [NCIT:C128322]	quinsy			UMLS:C0031157|ICD-9:475|SCTID:15033003|NCIT:C128322|MESH:D000039|ICD9:475|ICD10CM:J36|EFO:0007429	MONDO:0005906
MONDO:0015813	primary cutaneous marginal zone B-cell lymphoma	Disease	MONDO	Extranodal lymphoma of lymphoid tissue associated with mucosa that is in contact with exogenous antigens. Many of the sites of these lymphomas, such as the stomach, salivary gland, and thyroid, are normally devoid of lymphoid tissue. They acquire mucosa-associated lymphoid tissue (malt) type as a result of an immunologically mediated disorder. [MESH:D018442]	Primary cutaneous marginal zone B-cell lymphoma of mucosa-associated lymphoid tissue|marginal zone B cell lymphoma of skin|salt lymphoma|C-MALT|skin-associated lymphoid tissue lymphoma|Primary cutaneous marginal zone lymphoma of mucosa-associated lymphoid tissue|Primary cutaneous marginal zone B cell lymphoma of mucosa-associated lymphoid tissue|PCMZL|cutaneous Immunocytoma|marginal zone B cell lymphoma of the skin			UMLS:C1275321|SCTID:404140004|ORDO:178536|NCIT:C7230|Orphanet:178536	MONDO:0015813
MONDO:0054740	blepharocheilodontic syndrome 1	Disease	MONDO	Any blepharo-cheilo-odontic syndrome in which the cause of the disease is a mutation in the CDH1 gene. [MONDO:patterns/disease_series_by_gene]	clefting, ectropion, and conical teeth|elschnig syndrome|CDH1 blepharo-cheilo-odontic syndrome|BCDS1|blepharocheilodontic syndrome 1|ectropion, Inferior, with cleft 51P and/Or palate|Lagophthalmia with bilateral cleft 51P and palate|BCD syndrome|blepharocheilodontic syndrome|blepharo-cheilo-odontic syndrome caused by mutation in CDH1			OMIM:119580|DOID:0080345	MONDO:0054740
MONDO:0016913	partial deletion of the long arm of chromosome 15	Disease	MONDO		partial monosomy 15q|monosomy 15q|partial deletion of chromosome 15q|chromosome 15q deletion|15q deletion|deletion 15q|15q monosomy|partial monosomy of the long arm of chromosome 15|partial deletion of the long arm of chromosome type 15|partial monosomy of chromosome 15q			Orphanet:262119|GARD:0001746|MESH:C538038|ORDO:262119	MONDO:0016913
MONDO:0006292	malignant mesothelioma	Disease	MONDO	A malignant neoplasm of the pleura or peritoneum, arising from mesothelial cells. It is associated with exposure to asbestos. [NCIT:C4456]	mesothelioma, somatic|malignant mesothelioma (disease)|malignant mesothelioma|MESOM|advanced malignant mesothelioma|diffuse malignant mesothelioma|malignant tumor of mesothelium|malignant mesothelial tumor|asbestos-related malignant mesothelioma|malignant neoplasm of mesothelium|malignant mesothelial neoplasm|malignant neoplasm of the mesothelium|mesothelioma, malignant|malignant tumor of the mesothelium			ICDO:9050/3|ORDO:50251|HP:HP:0100001|UMLS:C0345967|MESH:C562839|ICD9:199.1|HP:0100001|GARD:0007026|Orphanet:50251|ICD-9:199.1|OMIM:156240|EFO:1000355|DOID:1790|UMLS:C0278752|SCTID:109378008|MedDRA:10027406|NCIT:C4456|UMLS:C1332338	MONDO:0006292
MONDO:0006462	thyroid gland diffuse large B-cell lymphoma	Disease	MONDO	A diffuse large B-cell lymphoma primarily involving the thyroid gland. [NCIT:C6046]	diffuse large B-cell lymphoma of thyroid|thyroid gland diffuse large B-cell lymphoma|diffuse large B-cell lymphoma of the thyroid gland|thyroid diffuse large B-cell lymphoma|diffuse large B-cell lymphoma of the thyroid|primary thyroid gland diffuse large B-cell lymphoma|diffuse large B-cell lymphoma of thyroid gland			NCIT:C6046|UMLS:C1336749|EFO:1000587	MONDO:0006462
MONDO:0006019	yaws	Disease	MONDO	An endemic, infectious, nonvenereal disease in humans that presents mainly in children younger than 15 years. The disease occurs primarily in warm, humid, tropical areas of Africa, Asia, South America, and Oceania, among poor rural populations where conditions of overcrowding and poor sanitation prevail. Infection with Treponema pertenue, a subspecies of Treponema pallidum, causes the disease. [NCIT:P378]	Bouba|frambesia|frambesia tropica|Treponema pertenue infection|frambosie|polypapilloma tropicum|endemic treponematoses|thymosis|Treponema pallidum subsp. pertenue disease or disorder|Treponema pallidum subsp. pertenue caused disease or disorder|Treponema pallidum subsp. pertenue infectious disease			UMLS:C0043388|GARD:0007913|DOID:10371|ICD-9:102.7|ICD9:102.7|NCIT:C41353|ICD10CM:A66|MESH:D015001|EFO:0007548|SCTID:70647001|ICD-9:102|ICD-9:102.9|ICD9:102|ICD9:102.9	MONDO:0006019
MONDO:0002870	tricuspid valve insufficiency	Disease	MONDO	The backflow of blood from the right ventricle into the right atrium, owning to imperfect functioning/insufficiency of the tricuspid valve. [NCIT:P378]	tricuspid regurgitation|tricuspid insufficiency|insufficiency, tricuspid|tricuspid valve regurgitation|tricuspid incompetence			SCTID:111287006|MESH:D014262|NCIT:C50842|DOID:4080|UMLS:C0040961	MONDO:0002870
MONDO:0003970	gastric fundus carcinoma	Disease	MONDO	A carcinoma that arises from epithelial cells of the fundus of stomach. [https://orcid.org/0000-0002-6601-2165]	fundus of stomach carcinoma|cancer of the gastric fundus|cancer of fundus of stomach|gastric fundus (stomach) cancer|carcinoma of the gastric fundus|carcinoma of gastric fundus|cancer of gastric fundus|carcinoma of the fundus of the stomach|carcinoma of fundus of stomach|gastric fundus cancer|cancer of the fundus of the stomach			DOID:6700|NCIT:C8398|UMLS:C0345799|SCTID:254555008	MONDO:0003970
MONDO:0030947	neurodegeneration, childhood-onset, with hypotonia, respiratory insufficiency, and brain imaging abnormalities	Disease	MONDO		CONRIBA|neurodegeneration, childhood-onset, hypotonia, respiratory insufficiency and brain imaging abnormalities			Orphanet:610573|ORDO:610573|OMIM:619173	MONDO:0030947
MONDO:0036918	punctate acrokeratoderma freckle-like pigmentation	Disease	MONDO					ORDO:99710|Orphanet:99710	MONDO:0036918
MONDO:0019202	myxofibrosarcoma	Disease	MONDO	A malignant fibroblastic neoplasm arising from the soft tissue. It is characterized by the presence of spindle-shaped cells, cellular pleomorphism, thin-walled blood vessels, fibrous septa, and myxoid stroma. [NCIT:C6496]	fibromyxosarcoma|myxoid malignant fibrous histiocytoma|myxofibrosarcoma|MFS|myxoid fibrous histiocytoma|myxoid MFH			Orphanet:79105|DOID:0080534|ORDO:79105|SCTID:253042009|ICDO:8811/3|MedDRA:10066948|ONCOTREE:MFS|NCIT:C6496	MONDO:0019202
MONDO:0019032	X-linked intellectual disability with isolated growth hormone deficiency	Disease	MONDO		MRGH			Orphanet:67045|ORDO:67045|UMLS:C1848068|ICD10CM:E23.0	MONDO:0019032
MONDO:0015270	butyrylcholinesterase deficiency	Disease	MONDO	Butyrylcholinesterase (BChE) deficiency is a metabolic disorder characterised by prolonged apnoea after the use of certain anaesthetic drugs, including the muscle relaxants succinylcholine or mivacurium and other ester local anaesthetics. The duration of the prolonged apnoea varies significantly depending on the extent of the enzyme deficiency. [Orphanet:132]	Acholinesterasemia|Suxamethonium sensitivity|succinylcholine sensitivity|apnea, postanesthetic|butyrylcholinesterase deficiency, fluoride-resistant, Japanese type|hypocholinesterasemia, fluoride-resistant, Japanese type|apnea, postanesthetic, susceptibility to, due to BCHE deficiency|butyrylcholinesterase deficiency|pseudocholinesterase E1|BCHED|pseudocholinesterase deficiency|cholinesterase 2 deficiency			MESH:C537417|GARD:0007482|OMIM:617936|ICD9:289.89|ORDO:132|SCTID:191397007|Orphanet:132|UMLS:C1283400|ICD-9:289.89	MONDO:0015270
MONDO:0024572	immunodeficiency-related disorder	Disease	MONDO	A non-neoplastic or neoplastic disorder that develops in a patient with immunodeficiency. Representative examples include AIDS-related disorders and disorders that develop following organ transplantation. [NCIT:C35686]	immunodeficiency-related disorder|Immunodepression-related disorder|Immunosuppression-related disorder|Immunosuppression disorders			UMLS:C1334159|NCIT:C35686	MONDO:0024572
MONDO:0000492	chronic venous insufficiency	Disease	MONDO	Chronic form of venous insufficiency (disease). [MONDO:patterns/chronic]	chronic venous insufficiency (disease)|venous insufficiency (disease), chronic			DOID:0050853|EFO:0007940|UMLS:C1306557	MONDO:0000492
MONDO:0016370	Marchiafava-Bignami disease	Disease	MONDO	Marchiafava Bignami disease is defined by characteristic demyelination of the corpus callosum (erosion of the protective covering of nerve fibers joining the 2 hemispheres of the brain). The disease seems to most often affect severe and chronic alcoholics in their middle or late adult life. Early symptoms may include depression, paranoia, psychosis, or dementia. Seizures are common, and hemiparesis, aphasia, abnormal movements, and ataxia may sometimesprogress to coma and/or death. The cause of Marchiafava Bignami disease, including the potential role of nutritional deficiency, remains unknown. Improvement and recovery of some individuals has been reported. Treatment focuses on nutritional support and rehabilitation from alcoholism. [https://rarediseases.info.nih.gov/diseases/6971/marchiafava-bignami-disease]	chronic Marchiafava-Bignami syndrome|metabolic bone disease|metabolic bone disorder|MBD|Marchiafava Bignami disease|acute Marchiafava-Bignami disease			SCTID:386766007|ICD9:341.8|EFO:1001809|MedDRA:10026828|NCIT:C97045|ICD-9:341.8|MESH:D054319|ORDO:221074|UMLS:C0238265|Orphanet:221074|GARD:0006971	MONDO:0016370
MONDO:0020980	hair nevus	Disease	MONDO	A usually benign congenital skin growth that is often pigmented and sometimes develop coarse surface hair. There is a lifetime risk of transformation to malignant melanoma which varies depending on the size of the lesion. [NCIT:C3074]	hair nevus|hairy nevus|nevoid hypertrichosis			NCIT:C3074|SCTID:201161009|UMLS:C0018508	MONDO:0020980
MONDO:0016540	congenital secondary polycythemia	Disease	MONDO		congenital secondary erythrocytosis			ORDO:238536|Orphanet:238536	MONDO:0016540
MONDO:0016710	medulloblastoma with extensive nodularity	Disease	MONDO	Medulloblastoma with extensive nodularity (MBEN) is a histological variant of medulloblastoma, an embryonic malignancy, most often located in the inferior medullary velum and then growing into the fourth ventricle, and presenting in infants and young children with symptoms of increased intracranial pressure such as headache, listlessness, vomiting, diplopia and papilledema. It is often associated with Gorlin syndrome and has a relatively good prognosis. [Orphanet:251858]	MBEN|nodular medulloblastoma|medulloblastoma with extensive nodularity|medulloblastoma with extensive nodularity and advanced neuronal differentiation|cerebellar neuroblastoma			ICDO:9471/3|NCIT:C5407|Orphanet:251858|UMLS:C1334970|UMLS:CN201957|ORDO:251858|ONCOTREE:MBEN	MONDO:0016710
MONDO:0001592	prolapse of female genital organ	Disease	MONDO					ICD-9:618.8|ICD9:618.89|ICD10CM:N81|ICD9:618.8|ICD-9:618.89|DOID:1284|SCTID:73998008|UMLS:C0156349	MONDO:0001592
MONDO:0020537	occupational allergic alveolitis	Disease	MONDO	Occupational allergic alveolitis designates a hypersensitivity pneumonitis resulting from the inhalation of an antigen to which an individual has been previously sensitized in his/her occupational environment. Symptoms vary depending on the antigen and the form (acute, subacute, chronic) of the disease. They may be cough, dyspnea, chills, fever, weight loss, loss of appetite and general malaise [Orphanet:99909]				Orphanet:99909|ORDO:99909	MONDO:0020537
MONDO:0017470	congenital knee dislocation	Disease	MONDO		congenital knee dislocation (disease)|congenital knee dislocation			SCTID:59068006|HP:0005191|ORDO:295034|Orphanet:295034|ICD-9:754.41|MedDRA:10010520|ICD9:754.41|HP:HP:0005191	MONDO:0017470
MONDO:0017640	cyanide-induced parkinsonism	Disease	MONDO	Cyanide-induced parkinsonism is a rare parkinsonian syndrome due to intoxication which develops in individuals surviving an acute cyanide intoxication episode or due to chronic exposure to small cyanide doses. It presents several weeks after acute exposure with progressive typical clinical features of parkinsonism including bradykinesia, rigidity, dystonia, hypomimia, hypokinetic dysarthria, postural instability and retropulsion but no resting or postural tremor. Brain MRI reveals bilateral lesions in the pallidum, posterior putamen, substantia nigra, subthalamic nucleus, temporal and occipital cortex, and cerebellum. [Orphanet:306692]				SCTID:766872002|UMLS:CN203536|ORDO:306692|Orphanet:306692	MONDO:0017640
MONDO:0017810	variant ABeta2M amyloidosis	Disease	MONDO	A rare form of amyloidosis characterized by accumulation and extensive visceral deposition of anamyloidogenic variant of beta 2 microglobulin leading to progressive gastrointestinal dysfunction, Sjögren syndrome and autonomic neuropathy. [Orphanet:314652]	autosomal dominant beta2-microglobulinic amyloidosis			DOID:0080929|UMLS:C4302669|Orphanet:314652|UMLS:CN203779|SCTID:722292000|ORDO:314652	MONDO:0017810
MONDO:0044747	human anaplasmosis	Disease	MONDO	An infection that is caused by Anaplasma phagocytophilum, which is transmitted to humans by infected ticks; it is characterized by fever, headache, chills, and myalgia. [NCIT:C128425]	human anaplasmosis|anaplasmoses|anaplasmosis			NCIT:C128425|ICD-9:082.49|ICD9:082.49|SCTID:427481004	MONDO:0044747
MONDO:0008711	Goodman syndrome	Disease	MONDO	Goodman syndrome is an extremely rare genetic disorder characterized by marked malformations of the head and face (essentially acrocephaly), abnormalities of the hands and feet (polydactyly, syndactyly, clinodactyly, camptodactyly, ulnar deviation), and congenital heart disease. There have been no further descriptions in the literature since 1979. Goodman syndrome could be a variant of Carpenter syndrome. [Orphanet:65798]	ACPS4|acrocephalopolysyndactyly type IV|acrocephalopolysyndactyly type 4|ACPS 4|Goodman syndrome|Goodman camptodactyly			OMIM:201020|GARD:0002549|MESH:C537287|Orphanet:65798|SCTID:720600004|ORDO:65798	MONDO:0008711
MONDO:0011186	Usher syndrome type 1F	Disease	MONDO	A form of Usher syndrome type IF that can be caused by homozygous or compound heterozygous mutation in the protocadherin-15 gene (PCDH15) on chromosome 10q. It is inherited in an autosomal recessive manner. [OMIM:602083]	Usher syndrome type IF|USH1F|Usher syndrome type 1F|USHER syndrome, type IF|Usher syndrome, type 1F			DOID:0110832|ICD10CM:H35.5|UMLS:C1865885|GARD:0010043|OMIM:602083	MONDO:0011186
MONDO:0032774	cerebellar, ocular, craniofacial, and genital syndrome	Disease	MONDO		CEREBELLAR, OCULAR, CRANIOFACIAL, AND GENITAL SYNDROME|COFG			OMIM:618479	MONDO:0032774
MONDO:0023642	Weber syndrome	Disease	MONDO		Weber-Gubler syndrome|Midbrain stroke syndromes|Weber Syndrome			GARD:0008676|ICD9:344.89|UMLS:C0455717|ICD-9:344.89|SCTID:24654003	MONDO:0023642
MONDO:0000544	mucosal melanoma	Disease	MONDO	A melanoma that arises from a mucosal site. [NCIT:P378]	mucosal melanoma			UMLS:C3898222|NCIT:C114828|DOID:0050929	MONDO:0000544
MONDO:0008670	Waardenburg syndrome type 1	Disease	MONDO	Waardenburg syndrome type 1 (WS1) is a subtype of Waardenburg syndrome (WS), disorder characterized by congenital deafness, minor defects in structures arising from neural crest resulting in pigmentation anomalies of eyes, hair, and skin, in combination with dystopia canthorum. [Orphanet:894]	Waardenburg's syndrome type 1|Waardenburg syndrome, type 1|Waardenburg syndrome type 1|Waardenburg syndrome with dystopia canthorum|Waardenburg syndrome type I|WS1			DOID:0110948|OMIM:193500|GARD:0005519|UMLS:C1847800|ORDO:894|Orphanet:894|NCIT:C75008|ICD10CM:E70.3	MONDO:0008670
MONDO:0008840	ataxia telangiectasia	Disease	MONDO	Ataxia-telangiectasia is the association of severe combined immunodeficiency (affecting mainly the humoral immune response) with progressive cerebellar ataxia. It is characterised by neurological signs, telangiectasias, increased susceptibility to infections and a higher risk of cancer. [Orphanet:100]	Louis Bar syndrome|AT, complementation group A|Louis-Bar syndrome|ataxia telangiectasia syndrome|ataxia - telangiectasia|cerebello-oculocutaneous telangiectasia|AT1|ataxia telangiectasia|boder-Sedgwick syndrome|AT, complementation group D|ataxia-telangiectasia|immunodeficiency with ataxia telangiectasia|AT, complementation group C|AT|AT, complementation group E|ataxia - telangiectasia variant			OMIM:208900|NCIT:C2887|UMLS:C1876175|MedDRA:10003594|ICD-9:334.8|SCTID:68504005|MESH:D001260|ICD9:334.8|GARD:0005862|Orphanet:100|UMLS:C0004135|DOID:12704|ORDO:100	MONDO:0008840
MONDO:0001644	acute proliferative glomerulonephritis	Disease	MONDO	Inflammation of the glomeruli status post infection with nephritogenic streptococci, most often group A beta hemolytic streptococcus. [NCIT:C35443]	acute glomerulonephritis with lesion of proliferative glomerulonephritis|proliferative glomerulonephritis, acute|post-streptococcal glomerulonephritis			DOID:13138|SCTID:197579006|ICD9:580.0|UMLS:C0403414|ICD-9:580.0|UMLS:C0341692|NCIT:C35443	MONDO:0001644
MONDO:0008227	peripheral dysostosis	Disease	MONDO		dysostosis peripheral|peripheral dysostosis			ORDO:1795|UMLS:CN074256|GARD:0002015|UMLS:C0220659|Orphanet:1795|OMIM:170700	MONDO:0008227
MONDO:0006879	optic papillitis	Disease	MONDO	Swelling of the optic disk, usually in association with increased intracranial pressure, characterized by hyperemia, blurring of the disk margins, microhemorrhages, blind spot enlargement, and engorgement of retinal veins. Chronic papilledema may cause optic atrophy and visual loss. (Miller et al., Clinical Neuro-Ophthalmology, 4th ed, p175) [MESH:D010211]	papilledema associated with increased intracranial pressure|edema, retinal|edema, optic disk|decreased intraocular pressure-associated papilledema|Edemas, retinal|decreased intraocular pressure associated papilledema|inflammation of optic disc|retinal Edemas|optic nerve papillitis|increased intracranial pressure associated papilledema|optic disk edema|papillitis, optic nerve|Choked disks|increased intracranial pressure-associated papilledema|disk, Choked|Choked disk|disks, Choked|optic papillitis|papillitis|optic discitis|Edemas, optic disk|edema, optic papilla|edema of the optic disc|optic papilla edema|retinal edema|papillitis, optic|papilledema associated with decreased intraocular pressure|optic disc inflammation			ICD-9:377.01|SCTID:423341008|MESH:D010211|ICD9:362.83|MedDRA:10030948|ICD-9:377.00|ICD-9:377.0|SCTID:73221001|ICD9:377.00|ICD9:377.0|ICD-9:377.31|ICD9:377.31|EFO:1001074|SCTID:6141006|DOID:10175|ICD-9:362.83|ICD9:377.01	MONDO:0006879
MONDO:0045038	cutaneous basidiobolomycosis	Disease	MONDO					SCTID:240786004|UMLS:C0343966	MONDO:0045038
MONDO:0002744	fallopian tube mucinous adenocarcinoma	Disease	MONDO	An extremely rare adenocarcinoma that arises from the fallopian tube. It is characterized by the presence of neoplastic epithelial cells that contain intracytoplasmic mucin. The cases that have been reported are predominantly in situ mucinous adenocarcinomas. [NCIT:C40103]	fallopian tube mucinous adenocarcinoma			NCIT:C40103|UMLS:C1517119|DOID:3704	MONDO:0002744
MONDO:0007979	metachondromatosis	Disease	MONDO	Metachondromatosis (MC) is a rare disorder characterized by the presence of both multiple enchondromas and osteochondroma-like lesions. [Orphanet:2499]	METACHONDROMATOSIS|METCDS|metachondromatosis			ICD9:756.59|MESH:C562938|Orphanet:2499|ORDO:2499|DOID:0111512|SCTID:205481009|ICD-9:756.59|GARD:0003560|OMIM:156250|UMLS:C0410530	MONDO:0007979
MONDO:0005905	periodic limb movement disorder	Disease	MONDO	Excessive periodic leg movements during sleep that cause micro-arousals and interfere with the maintenance of sleep. This condition induces a state of relative sleep deprivation which manifests as excessive daytime hypersomnolence. The movements are characterized by repetitive contractions of the tibialis anterior muscle, extension of the toe, and intermittent flexion of the hip, knee and ankle. (Adams et al., Principles of Neurology, 6th ed, p387) [MESH:D020189]	nocturnal myoclonus			ICD-9:327.51|ICD10CM:G47.61|DOID:9207|ICD9:327.51|EFO:0007428|UMLS:C0751774|SCTID:418763003	MONDO:0005905
MONDO:0011035	neurofibromatosis-Noonan syndrome	Disease	MONDO	A RASopathy and a variant of neurofibromatosis type 1 (NF1) characterized by the combination of features of NF1, such as cafC)-au-lait spots, iris Lisch nodules, axillary and inguinal freckling, optic nerve glioma and multiple neurofibromas; and Noonan syndrome (NS), such as short stature, typical facial features (hypertelorism, ptosis, downslanting palpebral fissures, low-set posteriorly rotated ears with a thickened helix, and a broad forehead), congenital heart defects and unusual pectus deformity. As these three entities have significant phenotypic overlap, molecular genetic testing is often necessary for a correct diagnosis (such as when cafC)-au-lait spots are present in patients diagnosed with NS). [Orphanet:638]	NFNS|Noonan neurofibromatosis syndrome|neurofibromatosis-Noonan syndrome|Noonan-neurofibromatosis syndrome|neurofibromatosis with Noonan phenotype|neurofibromatosis type 1-Noonan syndrome			SCTID:715344006|MESH:C537393|GARD:0000372|ORDO:638|DOID:0111683|OMIM:601321|MESH:D009456|Orphanet:638	MONDO:0011035
MONDO:0011408	hereditary spastic paraplegia 10	Disease	MONDO	Autosomal dominant spastic paraplegia type 10 (SPG10) is a rare type of hereditary spastic paraplegia that can present as either a pure form of spastic paraplegia with lower limb spasticity, hyperreflexia and extensor plantar responses, presenting in childhood or adolescence, or as a complex phenotype associated with additional manifestations including peripheral neuropathy with upper limb amyotrophy, moderate intellectual disability and parkinsonism. Deafness and retinitis pigmentosa were reported in one case. [Orphanet:100991]	hereditary spastic paraplegia type 10|spastic paraplegia 10|KIF5A hereditary spastic paraplegia|autosomal dominant spastic paraplegia 10|autosomal dominant spastic paraplegia|hereditary spastic paraplegia caused by mutation in KIF5A|SPG10|spastic paraplegia 10 with or without peripheral neuropathy|spastic paraplegia 10, autosomal dominant|autosomal dominant spastic paraplegia type 10			OMIM:604187|MESH:C537482|ORDO:100991|UMLS:C4518536|GARD:0009590|UMLS:C1858712|Orphanet:100991|DOID:0110763|SCTID:732948003	MONDO:0011408
MONDO:0012781	celiac disease, susceptibility to, 12	Disease	MONDO		celiac disease, susceptibility to, 12|CELIAC12|gluten-sensitive enteropathy, susceptibility to, 12			OMIM:612010	MONDO:0012781
MONDO:0021072	sympathetic paraganglioma	Disease	MONDO	A benign or malignant paraganglioma arising from the chromaffin cells of the paraganglia that are located along the sympathetic nerves. It includes extra-adrenal paragangliomas and paragangliomas that arise from the adrenal medulla. The latter are commonly referred to as pheochromocytomas. Representative examples of extra-adrenal sympathetic paragangliomas include the bladder, and superior and inferior paraaortic paragangliomas. Clinical signs are related to the secretion of catecholamines resulting in hypertension. [NCIT:C4216]	sympathetic paraganglioma|chromaffin tumor|sympathetic Paraganglionic neoplasm|paraganglioma of sympathetic nervous system|Chromaffinoma|sympathetic nervous system paraganglioma|chromaffin neoplasm			MESH:C531777|ICDO:8681/1|SCTID:399343007|NCIT:C4216	MONDO:0021072
MONDO:0015772	trisomy 8q	Disease	MONDO	Trisomy 8q is a very rare disorder characterized by duplication of the long arm of chromosome 8. The most commonly associated abnormalities include low birth weight, craniofacial abnormalities (prominent forehead, flat occiput, hypertelorism, upslanting palpebral fissures, ear and nose deformities, thin upper lips), congenital heart defects, skeletal defects, psychomotor retardation. Phenotypic features vary in relation to the duplication size. [Orphanet:1752]	8q duplication|Duplication 8q|8q trisomy|trisomy type 8q|chromosome 8q duplication|partial trisomy 8q			Orphanet:1752|GARD:0005362|NCIT:C36428|MESH:C538020|ORDO:1752|UMLS:C0795829	MONDO:0015772
