id	name	label	resource	description	synonyms	pmids	taxid	xrefs	raw_id
MONDO:0003100	nerve plexus neoplasm	Disease	MONDO	A neoplasm (disease) that involves the nerve plexus. [MONDO:patterns/location]	tumor of nerve plexus|neoplasm of the nerve plexus|nerve plexus neoplasm|nerve plexus neoplasm (disease)|neural plexus neoplasms|neoplasm of nerve plexus|tumor of the nerve plexus|nerve plexus tumor|nerve plexus tumors|nerve plexus neoplasms|neural plexus tumors			DOID:4693|UMLS:C1334945|NCIT:C5822	MONDO:0003100
MONDO:0011216	hemochromatosis type 2A	Disease	MONDO	Any hemochromatosis type 2 in which the cause of the disease is a mutation in the HJV gene. [MONDO:patterns/disease_series_by_gene]	hemochromatosis, juvenile|HJV hemochromatosis type 2|hemochromatosis type 2 caused by mutation in HJV|hemochromatosis, type 2|hemochromatosis, type 2A|HFE2A|hemochromatosis type 2A			OMIM:602390|DOID:0111027	MONDO:0011216
MONDO:0019172	aniridia	Disease	MONDO	Aniridia is a congenital ocular malformation characterized by the complete or partial absence of the iris. It can be isolated or part of a syndrome (isolated and syndromic aniridia). [Orphanet:77]	aplasia of iris			NCIT:C84563|ORDO:77|ICD-9:743.45|ICD9:743.45|Orphanet:77|SCTID:69278003|MESH:D015783|UMLS:C0003076|DOID:12271|GARD:0005816|MedDRA:10002532	MONDO:0019172
MONDO:0004200	superficial urinary bladder carcinoma	Disease	MONDO	A term used by urologists to describe an infiltrating carcinoma of the bladder that has not invaded into the muscularis propria of the bladder wall regardless of histologic type or grade. [NCIT:P378]	superficial bladder carcinoma|superficial urinary bladder carcinoma|superficial urinary bladder cancer|superficial bladder cancer			NCIT:C27474|UMLS:C1336527|SCTID:425231005|DOID:7371	MONDO:0004200
MONDO:0015580	distal monosomy 7q36	Disease	MONDO	Distal monosomy 7q36 is a rare chromosomal anomaly syndrome, resulting from a partial deletion of the long arm of chromosome 7, with a highly variable phenotype typically characterized by holoprosencephaly, growth restriction, developmental delay, facial dysmorphism (facial clefts, prominent forehead, hypertelorism, low-set ears, flat and broad nasal bridge, large mouth), abnormal fingers and palm or sole creases, ocular abnormalities, and other congenital malformations (incl. genital anomalies and caudal deficiency sequence). Cardiopathies have been occasionally reported. [Orphanet:1636]	monosomy 7qter|distal monosomy type 7q36|telomeric deletion 7q36|distal deletion 7q36			ORDO:1636|Orphanet:1636|SCTID:763529005	MONDO:0015580
MONDO:0012316	Majeed syndrome	Disease	MONDO	Majeed syndrome is a rare genetic multisystemic disorder characterized by the triad of chronic recurrent multifocal osteomyelitis, congenital dyserythropoietic anemia, and variable transient inflammatory dermatosis. [Orphanet:77297]	chronic recurrent multifocal osteomyelitis, congenital dyserythropoietic Anemia, and neutrophilic dermatosis|MAJEED syndrome|chronic recurrent multifocal osteomyelitis, congenital|dyserythropoietic anemia, and neutrophilic dermatosis|CDA and CRMO|congenital dyserythropoietic anemia and chronic recurrent multifocal osteomyelitis|chronic recurrent multifocal osteomyelitis-congenital dyserythropoietic anemia-neutrophilic dermatosis syndrome|MJDS|Majeed syndrome			UMLS:C1864997|Orphanet:77297|ICD9:759.89|ORDO:77297|OMIM:609628|ICD-9:759.89|MedDRA:10072223|GARD:0010088|NCIT:C119058|SCTID:703540008|MESH:C537839	MONDO:0012316
MONDO:0011046	short stature, Brussels type	Disease	MONDO	This syndrome is characterised by short stature presenting in the neonatal period associated with osteochondrodysplastic lesions and facial dysmorphism. [Orphanet:2867]	familial short stature with facial dysmorphism and osteochondrodysplastic lesions|Mievis Verellen-Dumoulin syndrome|Mievis-Verellen-Dumoulin syndrome|short stature syndrome, Brussels type			SCTID:719213009|Orphanet:2867|MESH:C537121|OMIM:601350|UMLS:C1832439|ORDO:2867|GARD:0004838	MONDO:0011046
MONDO:0016902	partial deletion of the long arm of chromosome 3	Disease	MONDO		partial monosomy of chromosome 3q|partial deletion of the long arm of chromosome type 3|partial deletion of chromosome 3q|partial monosomy of the long arm of chromosome 3			Orphanet:262019|ORDO:262019	MONDO:0016902
MONDO:0008894	cataract-hypertrichosis-intellectual disability syndrome	Disease	MONDO	Cataract-hypertrichosis-intellectual disability syndrome is characterized by congenital cataract, generalized hypertrichosis and intellectual deficit. It has been described in two Egyptian sibs born to consanguineous parents. It is transmitted as an autosomal recessive trait. [Orphanet:1375]	cataract, hypertrichosis, intellectual disability syndrome|cataract, hypertrichosis, mental retardation syndrome|CAHMR syndrome			UMLS:C0796282|OMIM:211770|MESH:C537959|SCTID:722379001|Orphanet:1375|ORDO:1375	MONDO:0008894
MONDO:0008530	teeth, odd shapes of	Disease	MONDO		conical teeth, multiple|teeth, odd shapes of|Lobodontia			UMLS:C1861274|OMIM:187000|MESH:C566076	MONDO:0008530
MONDO:0020729	autosomal recessive agammaglobulinemia 1	Disease	MONDO		agammaglobulinemia, autosomal recessive, due to IGHM defect|agammaglobulinemia 1, autosomal recessive|autosomal recessive agammaglobulinemia 1|AGM1			OMIM:601495|DOID:0081136	MONDO:0020729
MONDO:0017832	mycobacterium xenopi infection	Disease	MONDO	A disease caused by infection with Mycobacterium xenopi. [MONDO:patterns/infectious_disease_by_agent]	Mycobacterium xenopi disease or disorder|M. xenopi|Mycobacterium xenopi caused disease or disorder|Mycobacterium xenopi|Mycobacterium xenopi infectious disease			UMLS:C0275715|GARD:0010550|Orphanet:314946|ORDO:314946	MONDO:0017832
MONDO:0009630	microphthalmia, isolated, with coloboma 4	Disease	MONDO		microphthalmia with colobomatous cyst|microphthalmia, isolated, with coloboma type 4|microphthalmia, isolated, with coloboma 4|MCOPCB4			OMIM:251505|MESH:C565378|UMLS:C1855053|SCTID:715771008	MONDO:0009630
MONDO:0003346	central nervous system vasculitis	Disease	MONDO	Vasculitis affecting the blood vessels of the brain and/or spinal cord. [NCIT:P378]	vasculitis of central nervous system|central nervous system vasculitis			DOID:525|UMLS:C0751878|NCIT:C84622|MESH:D020293	MONDO:0003346
MONDO:0022904	cryofibrinogenemia	Disease	MONDO		cryofibrinogenemia			GARD:0009908|SCTID:10934005|MESH:C536218|ICD9:286.9|ICD-9:286.9|UMLS:C0272263	MONDO:0022904
MONDO:0018124	Oncogenic osteomalacia	Disease	MONDO	Oncogenic osteomalacia is characterized by the development of a tumor that causes the bones to be weakened. This occurs when a tumor secretes a substance called fibroblast growth factor 23 (FGF23). FGF23 inhibits the ability of the kidneys to absorb phosphate. Phosphate is important for keeping bones strong and healthy. Therefore, this disease is characterized by a softening and weakening of the bones (osteomalacia). The disease also results in multiple biochemical abnormalities including high levels of phosphate in the urine (hyperphosphaturia) and low levels of phosphate in the blood (hypophosphatemia). The majority of tumors that cause oncogenic osteomalacia are small and slow-growing. These tumors most commonly occur in the skin, muscles, or bones of the extremities or in the paranasal sinuses around the head. Most of these tumors are benign, meaning they are not associated with cancer. The exact reason that the tumors associated with oncogenic osteomalacia develop is not known. The disease is diagnosed when a person experiences clinical features such as bone weakening and hyperphosphaturia and a tumor is found by imaging of the body. Treatment of the disease consists of surgical removal of the tumor. The symptoms of the disease, including the weakening of the bones, typically resolve once the tumor is removed. [https://rarediseases.info.nih.gov/diseases/9652/oncogenic-osteomalacia]	OO|TIO|OOM|Oncogenic hypophosphatemic osteomalacia|tumor-induced osteomalacia			ORDO:352540|SCTID:392559009|NCIT:C67235|UMLS:C1274103|GARD:0009652|Orphanet:352540|MESH:C537751	MONDO:0018124
MONDO:0024934	fish disease	Disease	MONDO	Diseases of freshwater, marine, hatchery or aquarium fish. This term includes diseases of both teleosts (true fish) and elasmobranchs (sharks, rays and skates). [MESH:D005393]	diseases, fish|fish disease|disease, fish			UMLS:C0016154|MESH:D005393	MONDO:0024934
MONDO:0019224	inborn disorder of gamma-aminobutyric acid metabolism	Disease	MONDO	An inherited metabolic disease that is has its basis in the disruption of gamma-aminobutyric acid metabolic process. [MONDO:patterns/inborn_metabolic]	inborn error of gamma-aminobutyric acid metabolic process|disorder of GABA metabolism|disorder of gamma-aminobutyric acid metabolism|rare inborn error of gamma-aminobutyric acid metabolic process|inborn gamma-aminobutyric acid metabolic process disorder			ORDO:79175|UMLS:CN227591|Orphanet:79175	MONDO:0019224
MONDO:0015802	autosomal dominant non-syndromic intellectual disability	Disease	MONDO	Autosomal dominant form of non-syndromic intellectual disability. [MONDO:patterns/autosomal_dominant]	non-syndromic intellectual disability, autosomal dominant|autosomal dominant non-syndromic mental retardation|autosomal dominant non-syndromic intellectual disability|autosomal dominant mental retardation			Orphanet:178469|ORDO:178469|DOID:0060307|GARD:0012107|UMLS:CN200399	MONDO:0015802
MONDO:0015632	FASTKD2-related infantile mitochondrial encephalomyopathy	Disease	MONDO					Orphanet:166105|ORDO:166105	MONDO:0015632
MONDO:0000684	verbal auditory agnosia	Disease	MONDO	An agnosia that is a loss of the ability to recognising spoken words as semantically meaningful. [DOID:0060154, http://en.wikipedia.org/wiki/Agnosia]				DOID:0060154	MONDO:0000684
MONDO:0020356	coloboma of iris	Disease	MONDO	A congenital or acquired defect characterized by the presence of a hole in or adjacent to the iris. [NCIT:C98879]	coloboma of iris (disease)|coloboma of iris|coloboma of the iris			ORDO:98944|Orphanet:98944|NCIT:C98879|MedDRA:10052642|HP:HP:0000612|HP:0000612|SCTID:9446007|GARD:0001434	MONDO:0020356
MONDO:0020526	acute megakaryoblastic leukemia in down syndrome	Disease	MONDO		DS-AMKL			Orphanet:99887|ORDO:99887|UMLS:CN207426	MONDO:0020526
MONDO:0021456	benign neoplasm of sternum	Disease	MONDO	A benign neoplasm that involves the sternum. [MONDO:patterns/location]	benign neoplasm of the sternum|benign sternal neoplasm|benign tumor of sternum|sternum benign neoplasm|benign tumor of the sternum|benign sternal tumor			NCIT:C8416|UMLS:C0347312|SCTID:92410006	MONDO:0021456
MONDO:0018489	autoimmune encephalopathy with parasomnia and obstructive sleep apnea	Disease	MONDO	Autoimmune encephalopathy with parasomnia and obstructive sleep apnea is a rare neurologic disorder characterized by a unique non-REM and REM parasomnia with sleep breathing dysfunction, gait instability and repetitive episodes of respiratory insufficiency, as well as autoantibodies against IgLON5. Patients may present stridor, chorea, limb ataxia, abnormal ocular movements, and bulbar symptoms (i.e. dysphagia, dysarthria, episodic central hypoventilation) with normal brain MRI. Excessive day sleepiness and cognitive deterioration have also been reported. [Orphanet:420789]	anti-IgLON5 syndrome|anti-IgLON5 disease			Orphanet:420789|ORDO:420789|UMLS:CN237490|SCTID:765751002	MONDO:0018489
MONDO:0017016	obsolete primary interstitial lung disease specific to childhood due to alveolar structure disorder	Disease	MONDO		primary ILD specific to childhood due to alveolar structure disorder			Orphanet:264670|UMLS:CN202327	MONDO:0017016
MONDO:0019589	obsolete syndromic genetic hearing loss	Disease	MONDO		syndromic hearing loss|syndromic genetic deafness			SCTID:232333009|Orphanet:90642|UMLS:CN206426	MONDO:0019589
MONDO:0013424	3p- syndrome	Disease	MONDO	Distal monosomy 3p is a rare chromosomal anomaly syndrome, resulting from a partial deletion of the short arm of chromosome 3, with a highly variable phenotype typically characterized by pre- and post-natal growth retardation, intellectual disability, developmental delay and craniofacial dysmorphism (microcephaly, trigonocephaly, downslanting palpebral fissures, telecanthus, ptosis, micrognathia). Postaxial polydactyly, hypotonia, renal anomalies and congenital heart defects (e.g. atrioventricular septal defect) may be associated. [Orphanet:1620]	partial monosomy 3p|del(3p25)|chromosome 3, monosomy 3p25|chromosome 3p- syndrome|distal monosomy type 3p|monosomy 3pter|chromosome 3pter-p25 deletion syndrome|telomeric monosomy 3p|distal 3p deletion|chromosome 3p deletion|monosomy 3p|deletion 3p25|Del(3p) syndrome|deletion 3p|3p deletion|distal monosomy 3p|3p monosomy|3p- syndrome			GARD:0003750|DOID:0060417|MESH:C536804|ORDO:1620|SCTID:763528002|OMIM:613792|Orphanet:1620|NCIT:C41377|GARD:0000037	MONDO:0013424
MONDO:0013254	microcephaly, seizures, and developmental delay	Disease	MONDO		epileptic encephalopathy, early infantile, 10|microcephaly, seizures, and developmental delay|MCSZ|microcephaly - seizures - developmental delay|early infantile epileptic encephalopathy-10|EIEE10			DOID:0080457|ORDO:228418|Orphanet:228418|GARD:0010933|UMLS:C3150667|OMIM:613402	MONDO:0013254
MONDO:0032763	immunodeficiency 62	Disease	MONDO		IMMUNODEFICIENCY 62|immunodeficiency 62|IMD62			DOID:0111991|OMIM:618459	MONDO:0032763
MONDO:0007669	renal cysts and diabetes syndrome	Disease	MONDO	Renal cysts and diabetes syndrome (RCAD) is a rare form of maturity-onset diabetes of the young (MODY) characterized clinically by heterogeneous cystic renal disease and early-onset familial non-autoimmune diabetes. Pancreatic atrophy, liver dysfunction and genital tract anomalies are also features of the syndrome. [Orphanet:93111]	HNF1B-MODY|maturity-onset diabetes of the young type 5|RCAD|renal dysfunction-early-onset diabetes syndrome|atypical familial juvenile hyperuricemic nephropathy|FJHN, atypical|MODY5|RCAD syndrome|glomerulocystic kidney, familial hypoplastic|congenital anomalies of the kidney and urinary tract with diabetes|MODY type 5|familial hypoplastic glomerulocystic kidney|CAKUT with diabetes|HNF1B-related renal cysts and diabetes syndrome|hyperuricemic nephropathy, familial juvenile, atypical|maturity-onset diabetes of the Young, type 5|hypoplastic type glomerulocystic kidney disease|hepatocyte nuclear Factor 1-beta-associated monogenic diabetes|renal cysts and diabetes syndrome|glomerulocystic kidney disease, hypoplastic type|FJHN atypical|atypical FJHN|maturity onset diabetes of the Young, type 5|renal cysts-maturity-onset diabetes of the young syndrome			ORDO:93111|SCTID:446641003|Orphanet:93111|DOID:0111101|GARD:0010221|UMLS:C0431693|OMIM:137920|UMLS:CN206512|MESH:C535520|NCIT:C123018|DECIPHER:47	MONDO:0007669
MONDO:0024561	vitelliform macular dystrophy 3	Disease	MONDO	Any vitelliform macular dystrophy in which the cause of the disease is a mutation in the PRPH2 gene. [MONDO:patterns/disease_series_by_gene]	vitelliform macular dystrophy caused by mutation in PRPH2|PRPH2 vitelliform macular dystrophy|foveomacular dystrophy, adult-onset|VMD3|foveomacular dystrophy, adult-onset, with or without choroidal neovascularization|macular dystrophy, vitelliform, 3|vitelliform macular dystrophy, adult-onset			OMIM:608161	MONDO:0024561
MONDO:0005724	cryptococcosis	Disease	MONDO	An acute or chronic, localized or disseminated infection by Cryptococcus neoformans. Sites of involvement include the lungs, central nervous system and meninges, skin, and visceral organs.--2004 [NCIT:P378]	Busse-Buschke's disease|Cryptococcal infection|Cryptococcus neoformans infectious disease|torula|Cryptococcus neoformans disease or disorder|Cryptococcus neoformans caused disease or disorder|European cryptococcosis|torulosis|cryptococcus neoformans infection			DOID:12053|MESH:D003453|EFO:0007229|ICD-9:117.5|ORDO:1546|ICD10CM:B45|ICD9:117.5|SCTID:42386007|NCIT:C2967|MedDRA:10011490|GARD:0006218|UMLS:C0010414|Orphanet:1546	MONDO:0005724
MONDO:0005554	rheumatic disorder	Disease	MONDO	Inflammatory and degenerative diseases of connective tissue structures, such as arthritis. [NCIT:C27204]	collagen disease|inflammatory rheumatism|rheumatic disease|enthesopathy|rheumatologic disorder|rheumatism|connective tissue disease|collagen vascular disease|enthesopathies|disease, rheumatic|musculoskeletal pain disorder|diseases, rheumatic			Wikipedia:Rheumatism|EFO:0005755|ICD-9:729.0|NCIT:C27204|DOID:1575|UMLS:C0035435|MESH:D012216|ICD9:729.0|SCTID:396332003	MONDO:0005554
MONDO:0002563	jejunal somatostatinoma	Disease	MONDO	A somatostatin-producing neuroendocrine tumor that arises from the jejunum. It is characterized by the presence of tubulo-glandular structures. [NCIT:P378]	Delta cell tumor of jejunum|Somatosatinoma of jejunum|jejunal delta cell somatostatin producing tumor|jejunal somatostatin-producing neuroendocrine tumor|jejunal somatostatin-producing NET|Delta cell tumor of the jejunum|Somatosatinoma of the jejunum|jejunal somatostatin producing tumor			DOID:3216|UMLS:C1334297|NCIT:C5787	MONDO:0002563
MONDO:0043465	achlorhydria	Disease	MONDO	Absence of hydrochloric acid in the gastric juice. [NCIT:C2850]	hypochlorhydria|gastric anacidity|achylia gastrica|achlorhydria|absent gastric acidity			MESH:D000126|NCIT:C2850|SCTID:47481007	MONDO:0043465
MONDO:0020485	King-Denborough syndrome	Disease	MONDO	A rare genetic non-dystrophic myopathy characterized by the triad of congenital myopathy, dysmorphic features and susceptibility to malignant hyperthermia. Patients present with a wide phenotypic range, including delayed motor development, muscle weakness and fatigability, ptosis and facies myopathica (with or without creatine kinase elevations), skeletal abnormalities (e.g. short stature, scoliosis, kyphosis, lumbar lordosis and pectus carinatum/excavatum), mild dysmorphic facial features (e.g. hypertelorism, down-slanting palpebral fissures, epicanthic folds, low set ears, micrognathia), webbing of the neck, cryptorchidism, and a susceptibility to malignant hyperthermia and/or rhabdomyolysis due to intensive physical strain, viral infection or statin use. [Orphanet:99741]	King Denborough syndrome|anesthetic-induced malignant hyperpyrexia in children|Noonan like contracture myopathy hyperpyrexia|Koussef-Nichols syndrome|Kousseff Nichols syndrome			GARD:0008561|ORDO:99741|GARD:0008433|MESH:C536883|SCTID:764957003|OMIM:619542|Orphanet:99741|MESH:C537504	MONDO:0020485
MONDO:0004125	rectum leiomyoma	Disease	MONDO	A well-circumscribed benign smooth muscle neoplasm arising from the rectum. It is characterized by the presence of spindle cells with cigar-shaped nuclei, interlacing fascicles, and a whorled pattern. [NCIT:P378]	leiomyoma of the rectum|rectal leiomyoma|rectum leiomyoma|leiomyoma of rectum			NCIT:C5552|UMLS:C1335682|DOID:7160	MONDO:0004125
MONDO:0015148	lissencephaly type 3	Disease	MONDO					Orphanet:102011|DOID:0112232|ORDO:102011	MONDO:0015148
MONDO:0000363	gummatous syphilis	Disease	MONDO	A tertiary syphilis that is characterized by granulomatous lesions, called gummas, which are characterized by a center of necrotic tissue with a rubbery texture. They form in the liver, bones, and testes but may affect any organ. [DOID:0050584, http://emedicine.medscape.com/article/229461-overview#a0104]				DOID:0050584	MONDO:0000363
MONDO:0008046	autosomal dominant myoglobinuria	Disease	MONDO	Autosomal dominant myoglobinuria is a rare metabolic myopathy characterized by episodic myalgia with myoglobinuria which is induced by fever, viral or bacterial infection, prolonged exercise or alcohol abuse, and could, on occasion, lead to acute renal failure. Between episodes, patients may be asymptomatic or could present elevated creatine kinase levels and mild muscle weakness. There have been no further descriptions in the literature since 1997. [Orphanet:99846]	myoglobinuria, autosomal dominant			UMLS:C1834567|OMIM:160010|Orphanet:99846|MESH:C563546|SCTID:725903003|ORDO:99846	MONDO:0008046
MONDO:0001633	central retinal artery occlusion	Disease	MONDO	Blockage of the central retinal artery. [NCIT:P378]	central retinal arterial occlusion			NCIT:C34456|ICD9:362.31|DOID:13098|ICD-9:362.31|ICD10CM:H34.1|UMLS:C0007688|SCTID:38742007	MONDO:0001633
MONDO:0001463	splenic flexure cancer	Disease	MONDO	A malignant neoplasm involving the splenic flexure of colon. [https://orcid.org/0000-0002-6601-2165]	Ca splenic flexure - colon|cancer of splenic flexure of colon|malignant splenic flexure of colon neoplasm|splenic flexure of colon cancer|malignant tumor of splenic flexure|malignant neoplasm of splenic flexure of colon|malignant neoplasm of splenic flexure			SCTID:363413005|DOID:12191|ICD9:153.7|UMLS:C0153440|ICD-9:153.7	MONDO:0001463
MONDO:0008216	pelvic lipomatosis with crossed renal ectopia	Disease	MONDO		pelvic lipomatosis with crossed renal ectopia			UMLS:C1868511|MESH:C566812|OMIM:169545	MONDO:0008216
MONDO:0006698	cholecystolithiasis	Disease	MONDO	Single or multiple, ovoid or irregular, solid particles that are formed from bile, cholesterol, and calcium in the gallbladder cavity. [NCIT:P378]				UMLS:C0947622|MedDRA:10049890|DOID:11151|SCTID:235919008|MESH:D041761|EFO:1000864	MONDO:0006698
MONDO:0012826	scoliosis, isolated, susceptibility to, 4	Disease	MONDO		scoliosis, idiopathic, susceptibility to, 4|IS4|scoliosis, isolated, susceptibility to, 4			OMIM:612238	MONDO:0012826
MONDO:0010891	lethal hemolytic anemia-genital anomalies syndrome	Disease	MONDO	Waters-West syndrome is characterized by the association of lethal non-spherocytic, non-immune hemolytic anemia with abnormalities of the external genitalia (micropenis and hypospadias), flat occiput, dimpled earlobes, deep plantar creases, and increased space between the first and second toes. It has been described only once in two brothers who died a few hours after birth. The second-born infant had massive ascites and hepatosplenomegaly. The mother had two spontaneous abortions (at 6 and 12 weeks gestation) but gave birth to a normal girl, suggesting an autosomal or X-linked recessive mode of inheritance. Although the parents were not known to be consanguineous, they shared a French-Canadian and American Indian ethnic origin. [Orphanet:1046]	hemolytic anemia lethal congenital nonspherocytic with genital and other abnormalities|hemolytic anemia, lethal congenital nonspherocytic, with genital and other abnormalities|water-West syndrome			MESH:C563935|UMLS:C1838120|Orphanet:1046|GARD:0002642|OMIM:600461|ORDO:1046	MONDO:0010891
MONDO:0006451	thymic carcinoma	Disease	MONDO	Thymic carcinoma (TC) is a type of thymic epithelial neoplasm characterized by a high malignant potential. [Orphanet:99868]	THYC|carcinoma of thymus|type C thymoma|thymic carcinoma|thymic carcinoma (excluding well differentiated thymic carcinoma)|thymoma, type C (morphologic abnormality)|thymus carcinoma|thymoma type C|thymoma, malignant|thymoma, type C|thymoma, malignant (morphologic abnormality)|malignant thymoma|thymic carcinoma excluding well differentiated thymic carcinoma			GARD:0011952|DOID:3284|MedDRA:10061031|ORDO:99868|ONCOTREE:THYC|UMLS:C0205969|ICDO:8586/3|EFO:1000576|DOID:4554|SCTID:444374006|UMLS:CN207411|Orphanet:99868|NCIT:C7569|UMLS:C1322286	MONDO:0006451
MONDO:0005181	progressive external ophthalmoplegia	Disease	MONDO	A mitochondrial myopathy characterized by slowly progressive paralysis of the levator palpebrae, orbicularis oculi, and extraocular muscles. Ragged-red fibers and atrophy are found on muscle biopsy. Familial and sporadic forms may occur. Disease onset is usually in the first or second decade of life, and the illness slowly progresses until usually all ocular motility is lost. (From Adams et al., Principles of Neurology, 6th ed, p1422) [MESH:D017246]	chronic progressive external ophthalmoplegia [ambiguous]|chronic progressive external ophthalmoplegia|progressive external ophthalmoplegia			GARD:0004503|ICD9:378.72|Orphanet:520820|SCTID:46252003|ORDO:520820|DOID:12558|HP:HP:0000590|ICD-9:378.72|MESH:D017246|EFO:0002509|ICD10CM:H49.4|HP:0000590	MONDO:0005181
MONDO:0043839	ulcer disease	Disease	MONDO	A lesion on the surface of the skin or a mucous surface, produced by the sloughing of inflammatory necrotic tissue. [MESH:D014456]	ulcer|ulcers			UMLS:C0041582|NCIT:C3426|SCTID:429040005|MESH:D014456	MONDO:0043839
MONDO:0006281	lung signet ring cell carcinoma	Disease	MONDO	A morphologic variant of lung adenocarcinoma characterized by the presence of signet ring cells. [NCIT:C45514]	lung signet ring cell carcinoma|signet ring lung adenocarcinoma			ICD-9:162.9|SCTID:707407001|ICD9:162.9|DOID:0080305|EFO:1000338|NCIT:C45514	MONDO:0006281
MONDO:0033258	hearing loss, autosomal dominant 71	Disease	MONDO		deafness, autosomal dominant 71|DFNA71|autosomal dominant nonsyndromic deafness 71			OMIM:617605|DOID:0080267	MONDO:0033258
MONDO:0007381	epithelial recurrent erosion dystrophy	Disease	MONDO	Epithelial recurrent erosion dystrophy (ERED) is a rare form of superficial corneal dystrophy characterized by recurrent episodes of epithelial erosions from childhood in the absence of associated diseases, with occasional impairment of vision. [Orphanet:293381]	corneal erosions, recurring hereditary|epithelial recurrent erosion dystrophy|ERED|dystrophia Helsinglandica|recurrent hereditary corneal erosions|dystrophia Smolandiensis			UMLS:C1852551|DOID:0070337|Orphanet:293381|OMIM:122400|ORDO:293381|SCTID:715908008|MESH:C565155	MONDO:0007381
