id	name	label	resource	description	synonyms	pmids	taxid	xrefs	raw_id
MONDO:0015902	major hypertriglyceridemia	Disease	MONDO	Major hypertriglyceridemia comprises a group of endocrine diseases characterized by permanently high levels of triglycerides (TG) in the blood (higher than 4g/L after 12 hours of fasting) and an increased risk of acute pancreatitis, making screening essential. [Orphanet:181425]				Orphanet:181425|ORDO:181425	MONDO:0015902
MONDO:0005739	echinostomiasis	Disease	MONDO	Infection by flukes of the genus Echinostoma. [MESH:D004451]	Echinostomatoidea disease or disorder|Echinostomatoidea infectious disease|infection by Echinochasmus|Echinostomatoidea caused disease or disorder			DOID:1218|MESH:D004451|ICD-9:121.8|SCTID:52918004|EFO:0007246|UMLS:C0013514|ICD9:121.8	MONDO:0005739
MONDO:0006839	Lutembacher syndrome	Disease	MONDO	A condition characterized by a combination of ostium secundum atrial septal defect and an acquired mitral valve stenosis. [MESH:D008185]	Lutembacher's anomaly|Lutembachers syndrome|Lutembacher's syndrome|syndrome, Lutembacher|Lutembacher syndrome|syndrome, Lutembacher's			SCTID:204319006|UMLS:C0024164|DOID:1998|MESH:D008185|EFO:1001024	MONDO:0006839
MONDO:0013706	intellectual disability, autosomal recessive 23	Disease	MONDO		intellectual disability, autosomal recessive 23|MRT23|mental retardation, autosomal recessive 23			UMLS:C3280542|OMIM:614344|DOID:0081196	MONDO:0013706
MONDO:0003125	testicular sex cord-stromal neoplasm	Disease	MONDO	A benign or malignant tumor that arises from the testis. It is composed of granulosa cells, Leydig cells, Sertoli cells, and fibroblasts. Each of these cell types may constitute the only cellular component that is present in the tumor or it may be mixed with other cell types in various combinations. The prognosis can not always be predicted on histologic grounds alone. Approximately, ten percent of these tumors may metastasize. Representative examples include granulosa cell tumor, Leydig cell tumor, Sertoli cell tumor, and tumors of the thecoma-fibroma group. [NCIT:C6358]	sex cord-stromal tumor of the testis|sex cord-stromal neoplasm of testis|sex cord-stromal neoplasm|testicular sex cord-stromal neoplasm|sex cord-stromal neoplasm of the testis|sex cord-stromal tumor of testis|testicular sex cord-stromal tumor|testis sex cord-stromal tumor			SCTID:702406000|UMLS:CN204701|DOID:4757|Orphanet:363489|NCIT:C6358|UMLS:C3840076|ORDO:363489	MONDO:0003125
MONDO:0014806	spinal muscular atrophy with congenital bone fractures 1	Disease	MONDO	Any prenatal-onset spinal muscular atrophy with congenital bone fractures in which the cause of the disease is a mutation in the TRIP4 gene. [MONDO:patterns/disease_series_by_gene]	spinal muscular atrophy, type I, with congenital bone fractures|TRIP4 prenatal-onset spinal muscular atrophy with congenital bone fractures|spinal muscular atrophy with congenital bone fractures 1|spinal muscular atrophy with congenital bone fractures type 1|SMA1 with congenital bone fractures|SMABF1|prenatal-onset spinal muscular atrophy with congenital bone fractures caused by mutation in TRIP4|spinal muscular atrophy type 1 with congenital bone fractures			UMLS:C4225177|UMLS:C1849101|OMIM:616866|OMIM:271225|GARD:0004947|MESH:C564805	MONDO:0014806
MONDO:0005868	myelophthisic anemia	Disease	MONDO	A laboratory test result indicating an abnormal amount of circulating nucleated red blood cells and immature red blood cells. [NCIT:P378]	leukoerythroblastic reaction|anemia LEUKOERYTHROBLASTIC|leukoerythroblastosis|myelophthisis|anemia, leukoerythroblastic			EFO:0007388|DOID:2354|SCTID:2694001|MESH:D000750|ICD10CM:D61.82|UMLS:C0002890|ICD9:285.8|NCIT:C36218|ICD-9:285.8	MONDO:0005868
MONDO:0004225	monoclonal gammopathy of uncertain significance	Disease	MONDO	A condition characterized by the presence of a monoclonal gammopathy (MG) in which the clonal mass has not reached a predefined state in which the condition is considered malignant. Up to 25% of cases of monoclonal gammopathy of undetermined significance (MGUS) progress to a B-cell malignancy or myeloma. MGUS may occur in conjunction with various carcinomas, chronic inflammatory and infectious conditions, and other diseases. [NCIT:C3996]	monoclonal gammopathy of undetermined significance (morphologic abnormality)|monoclonal gammopathy, benign|monoclonal gammopathy of unknown significance|benign monoclonal gammopathy|monoclonal gammopathy Of undetermined significance (MGUS)|monoclonal gammopathy of undetermined significance (MGUS)|monoclonal gammopathy of undetermined significance|MGUS			UMLS:C0026470|EFO:1000836|MESH:D008998|GARD:0007034|ONCOTREE:MGUS|DOID:7442|NCIT:C3996|ICD-9:238.6|SCTID:58648008|SCTID:277577000|ICD9:238.6|ICDO:9765/1	MONDO:0004225
MONDO:0032672	intellectual developmental disorder with cardiac defects and dysmorphic facies	Disease	MONDO		INTELLECTUAL DEVELOPMENTAL DISORDER WITH CARDIAC DEFECTS AND DYSMORPHIC FACIES|IDDCDF			OMIM:618316|ORDO:562569|Orphanet:562569	MONDO:0032672
MONDO:0000633	sensory organ benign neoplasm	Disease	MONDO	A benign neoplasm that involves the sense organ. [MONDO:patterns/location]	sense organ benign neoplasm			DOID:0060096	MONDO:0000633
MONDO:0006968	shoulder impingement syndrome	Disease	MONDO	Compression of the rotator cuff tendons and subacromial bursa between the humeral head and structures that make up the coracoacromial arch and the humeral tuberosities. This condition is associated with subacromial bursitis and rotator cuff (largely supraspinatus) and bicipital tendon inflammation, with or without degenerative changes in the tendon. Pain that is most severe when the arm is abducted in an arc between 40 and 120 degrees, sometimes associated with tears in the rotator cuff, is the chief symptom. (From Jablonski's Dictionary of Syndromes and Eponymic Diseases, 2d ed) [MESH:D019534]	Impingement syndrome of shoulder region|subacromial impingement|shoulder impingement syndrome (disorder) [ambiguous]			ICD-9:726.2|MESH:D019534|ICD10CM:M75.4|UMLS:C0376685|DOID:14276|ICD9:726.2|EFO:1001178|MedDRA:10049039|SCTID:202849001	MONDO:0006968
MONDO:0005698	cervical incompetence	Disease	MONDO	A clinical diagnosis presenting with painless cervical dilatation and spontaneous mid-trimester birth in recurrent pregnancies in the absence of spontaneous membrane rupture, bleeding or clinical chorioamnionitis. [NCIT:P378]				ICD-9:622.5|EFO:0007202|ICD9:622.5|SCTID:17382005|DOID:9681|MESH:D002581|ICD9:654.50|ICD-9:654.50	MONDO:0005698
MONDO:0033198	hearing loss, autosomal recessive 106	Disease	MONDO		deafness autosomal recessive 106|deafness, autosomal recessive 106|DFNB106|autosomal recessive nonsyndromic deafness 106			DOID:0080261|OMIM:617637	MONDO:0033198
MONDO:0001733	occlusion of tributary of retinal vein	Disease	MONDO		venous tributary branch occlusion of retina|venous tributary occlusion of retina|venous tributary (branch) occlusion of retina			ICD-9:362.36|ICD9:362.36|DOID:13514	MONDO:0001733
MONDO:0006604	rosacea	Disease	MONDO	A chronic erythematous skin disorder that affects the face. It is characterized by the development of redness in the cheeks, nose, and/or forehead and telangiectasia. Sometimes, the erythematous changes may involve the eyelids. [NCIT:P378]	acne, erythematosa|acne roscea|acne rosacea			ICD10CM:L71|Wikipedia:Rosacea|DOID:8881|SCTID:398909004|ICD-9:695.3|MESH:D012393|EFO:1000760|NCIT:C97136|ICD9:695.3|UMLS:C0035854	MONDO:0006604
MONDO:0006798	hypervitaminosis A	Disease	MONDO	A symptom complex resulting from ingesting excessive amounts of vitamin A. [MESH:D006986]	hypervitaminosis type A			UMLS:C0020579|ICD-9:278.2|MedDRA:10020916|MESH:D006986|EFO:1000978|DOID:9972|ICD9:278.2|SCTID:64559002|ICD10CM:E67.0	MONDO:0006798
MONDO:0006230	gastric squamous cell carcinoma	Disease	MONDO	A rare carcinoma of the stomach resembling squamous cell carcinomas arising elsewhere in the body. [NCIT:C5475]	gastric squamous cell carcinoma|squamous cell carcinoma of the stomach|squamous cell carcinoma of stomach|stomach squamous cell carcinoma|gastric (stomach) squamous cell cancer			ORDO:418959|UMLS:C1333789|DOID:5516|UMLS:CN237470|EFO:1000278|Orphanet:418959|SCTID:766980008|NCIT:C5475	MONDO:0006230
MONDO:0010670	X-linked intellectual disability-spastic quadriparesis syndrome	Disease	MONDO		intellectual disability with spastic paraplegia|mental retardation with spastic paraplegia			UMLS:C1839727|Orphanet:163982|ORDO:163982|OMIM:309640|MESH:C564099	MONDO:0010670
MONDO:0010840	pachygyria-intellectual disability-epilepsy syndrome	Disease	MONDO	A rare, genetic neurological disorder characterized by the presence of diffuse pachygyria and arachnoid cysts, psychomotor developmental delay and intellectual disability. Seizures (absence, atonic and generalized tonic-clonic) and, on occasion, headache are also associated. [Orphanet:2798]	pachygyria, mental retardation and epilepsy|pachygyria with intellectual disability, seizures, and arachnoid cysts|pachygyria with intellectual disability and seizures|pachygyria with mental retardation, seizures, and arachnoid cysts|Kuzniecky syndrome|pachygyria, intellectual disability and epilepsy|pachygyria with mental retardation and seizures			Orphanet:2798|OMIM:600176|ORDO:2798|MESH:C538091|UMLS:C1838491|GARD:0000409|SCTID:763861000	MONDO:0010840
MONDO:0004099	adult cystic teratoma	Disease	MONDO	A cystic teratoma that occurs in an adult. [MONDO:design_pattern]	adult cystic teratoma|cystic teratoma of adults			DOID:7079|UMLS:C1368888|NCIT:C9012	MONDO:0004099
MONDO:0004269	breast cystic hypersecretory carcinoma	Disease	MONDO		cystic hypersecretory duct carcinoma of the breast|cystic hypersecretory carcinoma of the breast			DOID:7537	MONDO:0004269
MONDO:0010227	retinitis pigmentosa 3	Disease	MONDO	Any retinitis pigmentosa in which the cause of the disease is a mutation in the RPGR gene. [MONDO:patterns/disease_series_by_gene]	RP3|Choroidoretinal Degeneration with retinal reflex in heterozygous Women|retinitis pigmentosa caused by mutation in RPGR|retinitis pigmentosa 3|cone-rod Degeneration, X-linked|retinitis pigmentosa type 3|RPGR retinitis pigmentosa|retinitis pigmentosa 15			UMLS:C1845667|GARD:0010381|ICD10CM:H35.5|DOID:0110414|MESH:C564520|OMIM:300029	MONDO:0010227
MONDO:0011770	aortic aneurysm, familial thoracic 2	Disease	MONDO		AAT2|FAA2|aortic aneurysm, familial thoracic 2			OMIM:607087|UMLS:C1846837|MESH:C564627	MONDO:0011770
MONDO:0007330	congenital pseudoarthrosis of clavicle	Disease	MONDO	Congenital pseudoarthrosis of the clavicle is a rare benign condition, characterized by a painless mass or swelling over the clavicle. [Orphanet:66630]	congenital pseudoarthrosis of the clavicle|clavicle, pseudarthrosis of, congenital|congenital pseudarthrosis of the clavicle			SCTID:70794004|ORDO:66630|MESH:C562548|Orphanet:66630|OMIM:118980	MONDO:0007330
MONDO:0011940	mycobacterium tuberculosis, susceptibility to	Disease	MONDO		Mycobacterium tuberculosis, susceptibility to infection by|tuberculosis infection, protection against|mycobacterium tuberculosis, susceptibility to|Mycobacterium tuberculosis, protection against|tuberculosis, protection against|tuberculosis, susceptibility to			OMIM:607948|GARD:0002456|MESH:C536092	MONDO:0011940
MONDO:0016641	limb transversal defect-cardiac anomaly syndrome	Disease	MONDO		Hecht-Scott syndrome			Orphanet:2492|MESH:C535856|UMLS:C2931047|ORDO:2492	MONDO:0016641
MONDO:0020061	obsolete chromosome Y structural anomaly	Disease	MONDO					Orphanet:98158	MONDO:0020061
MONDO:0017741	disorder of protein O-glycosylation	Disease	MONDO	A disease that has its basis in the disruption of protein O-linked glycosylation. [MONDO:patterns/basis_in_disruption_of_process]	protein O-linked glycosylation disease|disorder of protein O-linked glycosylation			UMLS:CN227188|ORDO:309447|Orphanet:309447	MONDO:0017741
MONDO:0001777	acute gonococcal cystitis	Disease	MONDO	Acute form of gonococcal cystitis. [MONDO:patterns/acute]	gonococcal cystitis, acute|gonococcal cystitis (acute)|acute gonorrhea of bladder			DOID:13690|SCTID:24868007|ICD9:098.11|ICD-9:098.11|UMLS:C0153191	MONDO:0001777
MONDO:0021161	gonococcal prostatitis	Disease	MONDO	An prostatitis (disease) caused by infection with Neisseria gonorrhoeae. [MONDO:patterns/specific_infectious_disease_by_agent]	Neisseria gonorrhoeae caused prostatitis (disease)|Neisseria gonorrhoeae prostatitis (disease)			UMLS:C0341755|SCTID:197967000	MONDO:0021161
MONDO:0014433	Bardet-Biedl syndrome 4	Disease	MONDO		Bardet-Biedl syndrome type 4|BBS4|Bardet-Biedl syndrome 4			EFO:0009024|GARD:0000823|DOID:0110126|UMLS:C2936864|OMIM:615982|MESH:C537912	MONDO:0014433
MONDO:0004022	parasagittal meningioma	Disease	MONDO	A meningioma that affects the superior sagittal sinus and invades the parasagittal angle. [NCIT:C4960]				NCIT:C4960|UMLS:C0751304|DOID:6869	MONDO:0004022
MONDO:0035363	obsolete IRF2BPL-related regressive neurodevelopmental disorder-dystonia-seizures syndrome	Disease	MONDO						MONDO:0035363
MONDO:0014263	8q24.3 microdeletion syndrome	Disease	MONDO		chromosome 8Q24.3 deletion syndrome|VRJS|Verheij syndrome			OMIM:615583|ORDO:508488|GARD:0012814|UMLS:C3810023|Orphanet:508488	MONDO:0014263
MONDO:0000430	mature T-cell and NK-cell non-Hodgkin lymphoma	Disease	MONDO	This type of lymphoma is not frequently seen in the western hemisphere. Clinically, with the exception of anaplastic large cell lymphoma, mature T- and NK-cell lymphomas are among the most aggressive of all hematopoietic neoplasms. Representative disease entities include mycosis fungoides, angioimmunoblastic T-cell lymphoma, hepatosplenic T-cell lymphoma, and anaplastic large cell lymphoma. [NCIT:C3468]	mature T-cell lymphoma|mature T-cell non-Hodgkin's lymphoma|peripheral T-cell lymphoma|mature T-cell and natural killer cell lymphoma|mature T-cell and NK-cell lymphoma|mature T-and NK-cell lymphoma|mature T-cell and NK-cell non-Hodgkin lymphoma|mature T-cell and NK-cell non-Hodgkin's lymphoma|PTCL|NK-T cell lymphoma			MESH:D016411|ICDO:9702/3|ICD10CM:C84.4|NCIT:C3468|DOID:0050749|SCTID:109977009|DOID:0050743|GARD:0007368	MONDO:0000430
MONDO:0001530	secondary hyperparathyroidism of renal origin	Disease	MONDO		hyperparathyroidism due to renal insufficiency|secondary hyperparathyroidism (of renal origin)			DOID:12465|ICD-9:588.81|ICD9:588.81|UMLS:C0271847|ICD10CM:N25.81|SCTID:19034001	MONDO:0001530
MONDO:0001360	blind hypotensive eye	Disease	MONDO					DOID:11766|ICD-9:360.41|SCTID:23360000|UMLS:C0154788|ICD9:360.41	MONDO:0001360
MONDO:0002630	small cell osteogenic sarcoma	Disease	MONDO	An osteosarcoma usually arising from the metaphysis of long bones. It is characterized by the presence of small cells and osteoid production. The prognosis is usually unfavorable. [NCIT:P378]	round cell osteosarcoma|small cell osteosarcoma|SCOS			DOID:3377|NCIT:C4023|ICDO:9185/3|UMLS:C0279622|ONCOTREE:SCOS	MONDO:0002630
MONDO:0032871	leukodystrophy, hypomyelinating, 19, transient infantile	Disease	MONDO		HLD19|LEUKODYSTROPHY, HYPOMYELINATING, 19, TRANSIENT INFANTILE			OMIM:618688|DOID:0070400	MONDO:0032871
MONDO:0002460	lacrimal system cancer	Disease	MONDO	A cancer that involves the lacrimal apparatus. [MONDO:patterns/location]	lacrimal system neoplasm|lacrimal apparatus cancer|lacrimal system neoplasms|malignant neoplasm of lacrimal apparatus|cancer of lacrimal apparatus|neoplasm of the lacrimal system|lacrimal system tumor|tumor of lacrimal system|malignant lacrimal apparatus neoplasm|tumor of the lacrimal system|neoplasm of lacrimal system			UMLS:C1334361|NCIT:C5102|DOID:292|SCTID:416510003	MONDO:0002460
MONDO:0011941	mycobacterium tuberculosis, susceptibility to, 1	Disease	MONDO		mycobacterium tuberculosis, susceptibility to, 1|Mycobacterium tuberculosis, susceptibility to, type 1|tuberculosis, susceptibility to|MTBS1			OMIM:607949	MONDO:0011941
MONDO:0011771	distal spinal muscular atrophy type 3	Disease	MONDO	Distal spinal muscular atrophy type 3 is a rare neuromuscular disease characterized by progressive muscular weakness and atrophy predominantly affecting distal parts of limbs, later involvement of proximal and trunk muscles with marked hyperlordosis and late diaphragmatic dysfunction. [Orphanet:139547]	autosomal recessive distal spinal muscular atrophy type 3|spinal muscular atrophy, chronic distal, autosomal recessive|neuropathy, distal hereditary motor, type 4|dHMN3 and dHMN4|neuronopathy, distal hereditary motor, type 4|HMN 3|dHMN3|dSMA3|dHMN4|HMN 4|neuronopathy, distal hereditary motor, type 3|distal hereditary motor neuropathy type 3 and type 4|spinal muscular atrophy, distal, autosomal recessive, 3			ORDO:139547|DOID:0111211|UMLS:C1846823|MESH:C564626|OMIM:607088|Orphanet:139547	MONDO:0011771
MONDO:0010024	Beemer-Langer syndrome	Disease	MONDO	Short rib-polydactyly syndrome (SRPS), Beemer-Langer type is an extremely rare type of SRPS developing prenatally or immediately after birth and characterized by short and narrow thorax with horizontally oriented ribs. Other bone features include small iliac bones, short tubular bones, bowing of long bones and rarely pre- and post-axial polydactyly. Brain defects are common and some cases of cleft lip, absent internal genitalia and renal, biliary and pancreatic cysts have been reported. The course is rapidly fatal. [Orphanet:93268]	Beemer-Langer syndrome|short rib-polydactyly syndrome, Beemer-Langer type|short rib syndrome, Beemer type|short rib-polydactyly syndrome type IV|SRTD12|Srps 4|short-rib thoracic dysplasia 12|Beemer Langer syndrome|SRPS type 4|short rib polydactyly syndrome Beemer-Langer type|short rib-polydactyly syndrome type 4|short rib-polydactyly syndrome, type 4|short rib-polydactyly syndrome Beemer type|type IV short rib polydactyly syndrome			ICD9:756.9|MESH:C537599|OMIM:269860|GARD:0004832|Orphanet:93268|DOID:9249|ICD-9:756.9|ORDO:93268|UMLS:C0432198|SCTID:254052001	MONDO:0010024
MONDO:0007704	osteoarthritis susceptibility 2	Disease	MONDO		Dipoa|MATN3 osteoarthritis|hand osteoarthritis|osteoarthritis of distal interphalangeal joints|osteoarthritis susceptibility type 2|OADIP|osteoarthritis susceptibility 2|osteoarthritis caused by mutation in MATN3|Heberden nodes|OS2			OMIM:140600	MONDO:0007704
MONDO:0011124	spondyloepimetaphyseal dysplasia-abnormal dentition syndrome	Disease	MONDO	A rare primary bone dysplasia disorder characterized by the association of dental anomalies (oligodontia with pointed incisors) and generalized platyspondyly with epiphyseal and metaphyseal involvement. Thin tapering fingers and accentuated palmar creases are additional features. [https://orcid.org/0000-0001-5208-3432, Orphanet:168451]	spondyloepimetaphyseal dysplasia with abnormal dentition|SEMDAD			Orphanet:168451|OMIM:601668|ORDO:168451|MESH:C566644|UMLS:C1866507	MONDO:0011124
MONDO:0012224	febrile seizures, familial, 6	Disease	MONDO		convulsions, familial febrile, 6|febrile seizures, familial, 6|FEB6			DOID:0111309|UMLS:C1836518|OMIM:609253|MESH:C563764	MONDO:0012224
MONDO:0012054	schizophrenia 12	Disease	MONDO	A schizophrenia that has material basis in a mutation on chromosome 1p36.2. [DOID:0070088]	schizophrenia type 12|schizophrenia 12|Sczd12|SCZD12|schizophrenia susceptibility locus, chromosome 1P-related			UMLS:C1837893|DOID:0070088|OMIM:608543	MONDO:0012054
MONDO:0044644	congenital agenesis of the scrotum	Disease	MONDO		congenital scrotal absence|congenital absence of the scrotum|congenital scrotal agenesis			Orphanet:495879|ORDO:495879	MONDO:0044644
MONDO:0014679	polymicrogyria, perisylvian, with cerebellar hypoplasia and arthrogryposis	Disease	MONDO		polymicrogyria, perisylvian, with cerebellar hypoplasia and arthrogryposis|PMGYCHA			OMIM:616531|UMLS:C4225295	MONDO:0014679
MONDO:0006647	anterior cerebral artery infarction	Disease	MONDO	Necrosis occurring in the anterior cerebral artery system, including branches such as Heubner's artery. These arteries supply blood to the medial and superior parts of the cerebral hemisphere, Infarction in the anterior cerebral artery usually results in sensory and motor impairment in the lower body. [MESH:D020243]				MESH:D020243|UMLS:C0751843|EFO:1000807|DOID:3528	MONDO:0006647
MONDO:0006477	undifferentiated ovarian carcinoma	Disease	MONDO	An aggressive carcinoma arising from the ovary. Most patients present with advanced disease. Microscopically, it is characterized by significant cytologic atypia, increased mitotic activity, and necrosis. The prognosis is usually poor. [NCIT:C4509]	anaplastic carcinoma of ovary|anaplastic ovarian carcinoma|ovary undifferentiated carcinoma|undifferentiated ovarian carcinoma|anaplastic carcinoma of the ovary|undifferentiated ovarian cancer|undifferentiated carcinoma of the ovary|undifferentiated carcinoma of ovary|ovarian undifferentiated carcinoma			UMLS:C0346167|NCIT:C4509|SCTID:254856004|EFO:1000605	MONDO:0006477
MONDO:0013705	intellectual disability, autosomal recessive 19	Disease	MONDO		MRT19|intellectual disability, autosomal recessive 19|mental retardation, autosomal recessive 19			OMIM:614343|UMLS:C3280541	MONDO:0013705
MONDO:0030028	neurodegeneration, childhood-onset, with ataxia, tremor, optic atrophy, and cognitive decline	Disease	MONDO		neurodegeneration, childhood-onset, with ataxia, tremor, optic atrophy, and cognitive decline|NEURODEGENERATION, CHILDHOOD-ONSET, WITH ATAXIA, TREMOR, OPTIC ATROPHY, AND COGNITIVE DECLINE|CONATOC			OMIM:618868	MONDO:0030028
MONDO:0007747	isolated hyperchlorhidrosis	Disease	MONDO		hyperchlorhidrosis, isolated|isolated hyperchlorhidrosis			ICD9:276.9|DOID:0111371|SCTID:709413001|OMIM:143860|ICD-9:276.9|ORDO:542657|Orphanet:542657	MONDO:0007747
MONDO:0022400	retinal ciliopathy due to mutation in the RPGRIP gene	Disease	MONDO					ORDO:156174|Orphanet:156174	MONDO:0022400
MONDO:0007577	esophageal ring, lower	Disease	MONDO		esophageal ring, lower			UMLS:C0341137|ICD-9:750.3|ICD9:750.3|MESH:C562765|OMIM:133240|SCTID:235623002	MONDO:0007577
MONDO:0017784	Epstein-Barr virus-associated gastric carcinoma	Disease	MONDO	Epstein-Barr virus (EBV)-associated gastric carcinoma (EBVaGC) is a rare form of gastric carcinoma (seen in approximately 10% of cases) with a male predominance, characterized by a latent EBV infection in gastric carcinoma cells, diffuse-type histology, a proximal location (in the body and cardia of the stomach) and a relatively favorable prognosis. [Orphanet:313920]	EBV-associated gastric carcinoma|EBVaGC			Orphanet:313920|ORDO:313920|SCTID:716586009|UMLS:CN203734	MONDO:0017784
MONDO:0002642	trochlear nerve neoplasm	Disease	MONDO	A neoplasm involving a trochlear nerve. [MONDO:patterns/neoplasm]	IVth cranial nerve tumors|fourth cranial nerve tumor|fourth cranial nerve neoplasms|neoplasm of the trochlear nerve|fourth cranial nerve tumors|fourth cranial nerve neoplasm|neoplasm of the fourth cranial nerve|tumor of trochlear nerve|trochlear nerve neoplasm (disease)|neoplasm of fourth cranial nerve|IVth cranial nerve neoplasms|trochlear nerve tumor|tumor of the fourth cranial nerve|trochlear nerve neoplasms|neoplasm of trochlear nerve|tumor of the trochlear nerve|trochlear nerve tumors|tumor of fourth cranial nerve			ICD9:239.7|NCIT:C5825|DOID:3421|ICD-9:239.7|UMLS:C1263896|SCTID:126970001	MONDO:0002642
MONDO:0019132	spinal muscular atrophy-Dandy-Walker malformation-cataracts syndrome	Disease	MONDO					Orphanet:73245|ORDO:73245|UMLS:CN205656	MONDO:0019132
MONDO:0019302	obsolete mucopolysaccharidosis with skin involvement	Disease	MONDO						MONDO:0019302
MONDO:0002029	chronic gonorrhea of cervix	Disease	MONDO	Chronic form of gonococcal cervicitis. [MONDO:patterns/chronic]	gonococcal cervicitis, chronic|chronic gonococcal cervicitis			ICD-9:098.35|DOID:1512|UMLS:C0153206|SCTID:76802005|ICD9:098.35	MONDO:0002029
MONDO:0100309	hereditary ataxia	Disease	MONDO	An instance of an atactic disorder that is caused by an inherited genomic modification in an individual. [MONDO:patterns/hereditary]	rare hereditary ataxia|SCA			ICD10CM:G11|GARD:0010748|Orphanet:183518|SCTID:763597000|GARD:0006614|DOID:0050951|ORDO:183518|MESH:C531684	MONDO:0100309
MONDO:0015710	obsolete immune dysregulation disease with immunodeficiency	Disease	MONDO					UMLS:CN200214|Orphanet:169361	MONDO:0015710
MONDO:0015540	hemophagocytic syndrome	Disease	MONDO	Hemophagocytic syndrome (HPS) is a rare immune disease and a potentially life-threatening disorder characterized by cytokine storm and overwhelming inflammation causing fever, hepatosplenomegaly, cytopenia, hypertriglyceridemia, hyperferritinemia, and hemophagocytosis in bone marrow, liver, spleen or lymph nodes. It can be either primary due to a genetic defect (primary hemophagocytic lymphohistiocytosis), or secondary to malignancies, to infections, most commonly with viruses such as Epstein-Barr virus or cytomegalovirus, human immunodeficiency virus, or to autoimmune disorders such as systemic lupus erythematosus or adult-onset Still disease (secondary hemophagocytic lymphohistiocytosis). [Orphanet:158032]	familial histiocytic reticulosis|HLH|familial hemophagocytic lymphohistiocytosis|hemophagocytic lymphohistiocytosis|familial erythrophagocytic lymphohistiocytosis|haemophagocytic syndrome|FHL|hemophagocytic syndrome|hemophagocytic disorder			UMLS:C3887558|ICD9:288.8|SCTID:234437005|GARD:0006589|UMLS:C0024291|NCIT:C35439|ICD-9:288.8|Orphanet:158032|MedDRA:10058125|DOID:0050120|NCIT:C34792|ORDO:158032	MONDO:0015540
MONDO:0009139	dyssegmental dysplasia, Rolland-Desbuquois type	Disease	MONDO		dyssegmental dwarfism, Rolland-Desbuquois type|dyssegmental dysplasia Rolland-Desbuquois type|dyssegmental dysplasia, Rolland-Desbuquois type|Ddrd|Anisospondylic Camptomicromelic dwarfism, Rolland-Desbuquois type|dyssegmental dwarfism Rolland-Desbuquois type|Anisospondylic camptomicromelic dwarfism Rolland-Desbuquois type			ICD9:756.59|GARD:0009810|SCTID:95243004|OMIM:224400|Orphanet:156731|ORDO:156731|MESH:C537999|ICD-9:756.59|UMLS:C0432209	MONDO:0009139
